"No.","Time","Source","Destination","Protocol","Length","Info"
"1","2000-03-07 12:50:01,749301","202.77.162.213","172.16.115.20","TCP","74","47496  >  23 [SYN] Seq=0 Win=32768 Len=0 MSS=1460 WS=1 TSval=186587 TSecr=0"
"2","2000-03-07 12:50:01,749686","172.16.115.20","202.77.162.213","TCP","74","23  >  47496 [SYN, ACK] Seq=0 Ack=1 Win=10136 Len=0 TSval=9212571 TSecr=186587 WS=1 MSS=1460"
"3","2000-03-07 12:50:01,749838","202.77.162.213","172.16.115.20","TCP","66","47496  >  23 [ACK] Seq=1 Ack=1 Win=33580 Len=0 TSval=186587 TSecr=9212571"
"4","2000-03-07 12:50:01,819752","172.16.115.20","202.77.162.213","TELNET","81","Telnet Data ..."
"5","2000-03-07 12:50:01,822889","202.77.162.213","172.16.115.20","TELNET","81","Telnet Data ..."
"6","2000-03-07 12:50:01,823093","172.16.115.20","202.77.162.213","TCP","66","23  >  47496 [ACK] Seq=16 Ack=16 Win=10136 Len=0 TSval=9212578 TSecr=186588"
"7","2000-03-07 12:50:01,825979","172.16.115.20","202.77.162.213","TELNET","102","Telnet Data ..."
"8","2000-03-07 12:50:01,841817","202.77.162.213","172.16.115.20","TCP","66","47496  >  23 [ACK] Seq=16 Ack=52 Win=33580 Len=0 TSval=186588 TSecr=9212579"
"9","2000-03-07 12:50:01,877902","172.16.115.20","202.77.162.213","TELNET","75","Telnet Data ..."
"10","2000-03-07 12:50:01,880480","202.77.162.213","172.16.115.20","TELNET","75","Telnet Data ..."
"11","2000-03-07 12:50:01,880731","172.16.115.20","202.77.162.213","TELNET","73","Telnet Data ..."
"12","2000-03-07 12:50:01,882841","202.77.162.213","172.16.115.20","TELNET","75","Telnet Data ..."
"13","2000-03-07 12:50:01,883039","172.16.115.20","202.77.162.213","TELNET","69","Telnet Data ..."
"14","2000-03-07 12:50:01,901807","202.77.162.213","172.16.115.20","TCP","66","47496  >  23 [ACK] Seq=34 Ack=71 Win=33580 Len=0 TSval=186588 TSecr=9212584"
"15","2000-03-07 12:50:01,902027","172.16.115.20","202.77.162.213","TELNET","85","Telnet Data ..."
"16","2000-03-07 12:50:01,904099","202.77.162.213","172.16.115.20","TELNET","75","Telnet Data ..."
"17","2000-03-07 12:50:01,904907","172.16.115.20","202.77.162.213","TELNET","68","Telnet Data ..."
"18","2000-03-07 12:50:01,921830","202.77.162.213","172.16.115.20","TCP","66","47496  >  23 [ACK] Seq=43 Ack=92 Win=33580 Len=0 TSval=186588 TSecr=9212587"
"19","2000-03-07 12:50:01,948795","172.16.115.20","202.77.162.213","TELNET","121","Telnet Data ..."
"20","2000-03-07 12:50:01,961831","202.77.162.213","172.16.115.20","TCP","66","47496  >  23 [ACK] Seq=43 Ack=147 Win=33580 Len=0 TSval=186588 TSecr=9212591"
"21","2000-03-07 12:50:02,007216","172.16.115.20","202.77.162.213","TELNET","128","Telnet Data ..."
"22","2000-03-07 12:50:02,021776","202.77.162.213","172.16.115.20","TCP","66","47496  >  23 [ACK] Seq=43 Ack=209 Win=33580 Len=0 TSval=186588 TSecr=9212597"
"23","2000-03-07 12:50:02,035614","172.16.115.20","202.77.162.213","TELNET","68","Telnet Data ..."
"24","2000-03-07 12:50:02,038709","202.77.162.213","172.16.115.20","TELNET","87","Telnet Data ..."
"25","2000-03-07 12:50:02,039123","172.16.115.20","202.77.162.213","TELNET","87","Telnet Data ..."
"26","2000-03-07 12:50:02,051859","202.77.162.213","172.16.115.20","TCP","66","47496  >  23 [ACK] Seq=64 Ack=232 Win=33580 Len=0 TSval=186588 TSecr=9212600"
"27","2000-03-07 12:50:02,054156","172.16.115.20","202.77.162.213","TELNET","68","Telnet Data ..."
"28","2000-03-07 12:50:02,058656","202.77.162.213","172.16.115.20","TELNET","84","Telnet Data ..."
"29","2000-03-07 12:50:02,059037","172.16.115.20","202.77.162.213","TELNET","84","Telnet Data ..."
"30","2000-03-07 12:50:02,071760","202.77.162.213","172.16.115.20","TCP","66","47496  >  23 [ACK] Seq=82 Ack=252 Win=33580 Len=0 TSval=186588 TSecr=9212602"
"31","2000-03-07 12:50:02,071946","172.16.115.20","202.77.162.213","TELNET","68","Telnet Data ..."
"32","2000-03-07 12:50:02,076105","202.77.162.213","172.16.115.20","TELNET","147","Telnet Data ..."
"33","2000-03-07 12:50:02,076695","172.16.115.20","202.77.162.213","TELNET","147","Telnet Data ..."
"34","2000-03-07 12:50:02,091814","202.77.162.213","172.16.115.20","TCP","66","47496  >  23 [ACK] Seq=163 Ack=335 Win=33580 Len=0 TSval=186588 TSecr=9212604"
"35","2000-03-07 12:50:02,101201","172.16.115.20","202.77.162.213","TCP","60","1023  >  514 [SYN] Seq=0 Win=8760 Len=0 MSS=1460"
"36","2000-03-07 12:50:02,101355","202.77.162.213","172.16.115.20","TCP","60","514  >  1023 [SYN, ACK] Seq=0 Ack=1 Win=33580 Len=0 MSS=1460"
"37","2000-03-07 12:50:02,101561","172.16.115.20","202.77.162.213","TCP","60","1023  >  514 [ACK] Seq=1 Ack=1 Win=8760 Len=0"
"38","2000-03-07 12:50:02,101733","172.16.115.20","202.77.162.213","RSH","60","Session Establishment"
"39","2000-03-07 12:50:02,145960","202.77.162.213","172.16.115.20","TCP","60","514  >  1023 [ACK] Seq=1 Ack=2 Win=33580 Len=0"
"40","2000-03-07 12:50:02,146207","172.16.115.20","202.77.162.213","RSH","139","Session Establishment"
"41","2000-03-07 12:50:02,229831","202.77.162.213","172.16.115.20","RSH","60","Server username:root Server -> Client Data"
"42","2000-03-07 12:50:02,229976","172.16.115.20","202.77.162.213","TCP","60","1023  >  514 [ACK] Seq=87 Ack=2 Win=8760 Len=0"
"43","2000-03-07 12:50:02,285176","202.77.162.213","172.16.115.20","RSH","105","Server username:root Server -> Client Data"
"44","2000-03-07 12:50:02,285507","172.16.115.20","202.77.162.213","TCP","60","1023  >  514 [FIN, ACK] Seq=87 Ack=53 Win=8760 Len=0"
"45","2000-03-07 12:50:02,285645","202.77.162.213","172.16.115.20","TCP","60","514  >  1023 [ACK] Seq=53 Ack=88 Win=33580 Len=0"
"46","2000-03-07 12:50:02,285824","202.77.162.213","172.16.115.20","TCP","60","514  >  1023 [FIN, ACK] Seq=53 Ack=88 Win=33580 Len=0"
"47","2000-03-07 12:50:02,285977","172.16.115.20","202.77.162.213","TCP","60","1023  >  514 [ACK] Seq=88 Ack=54 Win=8760 Len=0"
"48","2000-03-07 12:50:02,286629","172.16.115.20","202.77.162.213","TCP","60","1022  >  514 [SYN] Seq=0 Win=8760 Len=0 MSS=1460"
"49","2000-03-07 12:50:02,286783","202.77.162.213","172.16.115.20","TCP","60","514  >  1022 [SYN, ACK] Seq=0 Ack=1 Win=33580 Len=0 MSS=1460"
"50","2000-03-07 12:50:02,286948","172.16.115.20","202.77.162.213","TCP","60","1022  >  514 [ACK] Seq=1 Ack=1 Win=8760 Len=0"
"51","2000-03-07 12:50:02,287065","172.16.115.20","202.77.162.213","RSH","60","Session Establishment"
"52","2000-03-07 12:50:02,345903","202.77.162.213","172.16.115.20","TCP","60","514  >  1022 [ACK] Seq=1 Ack=2 Win=33580 Len=0"
"53","2000-03-07 12:50:02,346137","172.16.115.20","202.77.162.213","RSH","125","Session Establishment"
"54","2000-03-07 12:50:02,545910","202.77.162.213","172.16.115.20","TCP","60","514  >  1022 [ACK] Seq=1 Ack=73 Win=33580 Len=0"
"55","2000-03-07 12:50:03,405624","202.77.162.213","172.16.115.20","RSH","60","Server username:root Server -> Client Data"
"56","2000-03-07 12:50:03,405799","172.16.115.20","202.77.162.213","TCP","60","1022  >  514 [ACK] Seq=73 Ack=2 Win=8760 Len=0"
"57","2000-03-07 12:50:03,406133","172.16.115.20","202.77.162.213","RSH","60","Server username:root Client -> Server data"
"58","2000-03-07 12:50:03,464975","202.77.162.213","172.16.115.20","RSH","77","Server username:root Server -> Client Data"
"59","2000-03-07 12:50:03,466134","172.16.115.20","202.77.162.213","RSH","60","Server username:root Client -> Server data"
"60","2000-03-07 12:50:03,473075","202.77.162.213","172.16.115.20","RSH","1514","Server username:root Server -> Client Data"
"61","2000-03-07 12:50:03,474330","202.77.162.213","172.16.115.20","RSH","1514","Server username:root Server -> Client Data"
"62","2000-03-07 12:50:03,475568","202.77.162.213","172.16.115.20","RSH","1514","Server username:root Server -> Client Data"
"63","2000-03-07 12:50:03,475636","172.16.115.20","202.77.162.213","TCP","60","1022  >  514 [ACK] Seq=75 Ack=1485 Win=24820 Len=0"
"64","2000-03-07 12:50:03,475707","172.16.115.20","202.77.162.213","TCP","60","1022  >  514 [ACK] Seq=75 Ack=2945 Win=24820 Len=0"
"65","2000-03-07 12:50:03,477177","202.77.162.213","172.16.115.20","RSH","1514","Server username:root Server -> Client Data"
"66","2000-03-07 12:50:03,477351","172.16.115.20","202.77.162.213","TCP","60","1022  >  514 [ACK] Seq=75 Ack=5865 Win=24820 Len=0"
"67","2000-03-07 12:50:03,480667","202.77.162.213","172.16.115.20","RSH","1514","Server username:root Server -> Client Data"
"68","2000-03-07 12:50:03,482305","202.77.162.213","172.16.115.20","RSH","1514","Server username:root Server -> Client Data"
"69","2000-03-07 12:50:03,483537","202.77.162.213","172.16.115.20","RSH","1514","Server username:root Server -> Client Data"
"70","2000-03-07 12:50:03,483662","172.16.115.20","202.77.162.213","TCP","60","1022  >  514 [ACK] Seq=75 Ack=8785 Win=24820 Len=0"
"71","2000-03-07 12:50:03,484860","202.77.162.213","172.16.115.20","RSH","1514","Server username:root Server -> Client Data"
"72","2000-03-07 12:50:03,486082","202.77.162.213","172.16.115.20","RSH","1514","Server username:root Server -> Client Data"
"73","2000-03-07 12:50:03,486159","172.16.115.20","202.77.162.213","TCP","60","1022  >  514 [ACK] Seq=75 Ack=11705 Win=24820 Len=0"
"74","2000-03-07 12:50:03,487391","202.77.162.213","172.16.115.20","RSH","1514","Server username:root Server -> Client Data"
"75","2000-03-07 12:50:03,487565","172.16.115.20","202.77.162.213","TCP","60","1022  >  514 [ACK] Seq=75 Ack=14625 Win=24820 Len=0"
"76","2000-03-07 12:50:03,492356","202.77.162.213","172.16.115.20","RSH","1514","Server username:root Server -> Client Data"
"77","2000-03-07 12:50:03,493722","202.77.162.213","172.16.115.20","RSH","1514","Server username:root Server -> Client Data"
"78","2000-03-07 12:50:03,494992","202.77.162.213","172.16.115.20","RSH","1514","Server username:root Server -> Client Data"
"79","2000-03-07 12:50:03,495056","172.16.115.20","202.77.162.213","TCP","60","1022  >  514 [ACK] Seq=75 Ack=17545 Win=24820 Len=0"
"80","2000-03-07 12:50:03,496375","202.77.162.213","172.16.115.20","RSH","1514","Server username:root Server -> Client Data"
"81","2000-03-07 12:50:03,497611","202.77.162.213","172.16.115.20","RSH","1514","Server username:root Server -> Client Data"
"82","2000-03-07 12:50:03,497690","172.16.115.20","202.77.162.213","TCP","60","1022  >  514 [ACK] Seq=75 Ack=20465 Win=24820 Len=0"
"83","2000-03-07 12:50:03,498987","202.77.162.213","172.16.115.20","RSH","1514","Server username:root Server -> Client Data"
"84","2000-03-07 12:50:03,500198","202.77.162.213","172.16.115.20","RSH","1514","Server username:root Server -> Client Data"
"85","2000-03-07 12:50:03,500278","172.16.115.20","202.77.162.213","TCP","60","1022  >  514 [ACK] Seq=75 Ack=23385 Win=24820 Len=0"
"86","2000-03-07 12:50:03,501520","202.77.162.213","172.16.115.20","RSH","1514","Server username:root Server -> Client Data"
"87","2000-03-07 12:50:03,502743","202.77.162.213","172.16.115.20","RSH","1514","Server username:root Server -> Client Data"
"88","2000-03-07 12:50:03,502818","172.16.115.20","202.77.162.213","TCP","60","1022  >  514 [ACK] Seq=75 Ack=26305 Win=24820 Len=0"
"89","2000-03-07 12:50:03,504061","202.77.162.213","172.16.115.20","RSH","1514","Server username:root Server -> Client Data"
"90","2000-03-07 12:50:03,504240","172.16.115.20","202.77.162.213","TCP","60","1022  >  514 [ACK] Seq=75 Ack=29225 Win=24820 Len=0"
"91","2000-03-07 12:50:03,505471","202.77.162.213","172.16.115.20","RSH","1514","Server username:root Server -> Client Data"
"92","2000-03-07 12:50:03,506719","202.77.162.213","172.16.115.20","RSH","1514","Server username:root Server -> Client Data"
"93","2000-03-07 12:50:03,508043","202.77.162.213","172.16.115.20","RSH","1514","Server username:root Server -> Client Data"
"94","2000-03-07 12:50:03,508112","172.16.115.20","202.77.162.213","TCP","60","1022  >  514 [ACK] Seq=75 Ack=32145 Win=24820 Len=0"
"95","2000-03-07 12:50:03,509440","202.77.162.213","172.16.115.20","RSH","1514","Server username:root Server -> Client Data"
"96","2000-03-07 12:50:03,510669","202.77.162.213","172.16.115.20","RSH","1514","Server username:root Server -> Client Data"
"97","2000-03-07 12:50:03,510747","172.16.115.20","202.77.162.213","TCP","60","1022  >  514 [ACK] Seq=75 Ack=35065 Win=24820 Len=0"
"98","2000-03-07 12:50:03,512251","202.77.162.213","172.16.115.20","RSH","1514","Server username:root Server -> Client Data"
"99","2000-03-07 12:50:03,513481","202.77.162.213","172.16.115.20","RSH","1514","Server username:root Server -> Client Data"
"100","2000-03-07 12:50:03,513563","172.16.115.20","202.77.162.213","TCP","60","1022  >  514 [ACK] Seq=75 Ack=37985 Win=24820 Len=0"
"101","2000-03-07 12:50:03,514813","202.77.162.213","172.16.115.20","RSH","1514","Server username:root Server -> Client Data"
"102","2000-03-07 12:50:03,516053","202.77.162.213","172.16.115.20","RSH","1514","Server username:root Server -> Client Data"
"103","2000-03-07 12:50:03,516131","172.16.115.20","202.77.162.213","TCP","60","1022  >  514 [ACK] Seq=75 Ack=40905 Win=24820 Len=0"
"104","2000-03-07 12:50:03,517446","202.77.162.213","172.16.115.20","RSH","1514","Server username:root Server -> Client Data"
"105","2000-03-07 12:50:03,517633","172.16.115.20","202.77.162.213","TCP","60","1022  >  514 [ACK] Seq=75 Ack=43825 Win=24820 Len=0"
"106","2000-03-07 12:50:03,518672","202.77.162.213","172.16.115.20","RSH","431","Server username:root Server -> Client Data"
"107","2000-03-07 12:50:03,519230","172.16.115.20","202.77.162.213","RSH","60","Server username:root Client -> Server data"
"108","2000-03-07 12:50:03,521321","202.77.162.213","172.16.115.20","TCP","60","514  >  1022 [FIN, ACK] Seq=44202 Ack=76 Win=33580 Len=0"
"109","2000-03-07 12:50:03,521446","172.16.115.20","202.77.162.213","TCP","60","1022  >  514 [ACK] Seq=76 Ack=44203 Win=24820 Len=0"
"110","2000-03-07 12:50:03,521631","172.16.115.20","202.77.162.213","TCP","60","1022  >  514 [FIN, ACK] Seq=76 Ack=44203 Win=24820 Len=0"
"111","2000-03-07 12:50:03,521753","202.77.162.213","172.16.115.20","TCP","60","514  >  1022 [ACK] Seq=44203 Ack=77 Win=33580 Len=0"
"112","2000-03-07 12:50:03,524504","172.16.115.20","202.77.162.213","TELNET","68","Telnet Data ..."
"113","2000-03-07 12:50:03,529784","202.77.162.213","172.16.115.20","TELNET","88","Telnet Data ..."
"114","2000-03-07 12:50:03,530179","172.16.115.20","202.77.162.213","TELNET","88","Telnet Data ..."
"115","2000-03-07 12:50:03,541680","202.77.162.213","172.16.115.20","TCP","66","47496  >  23 [ACK] Seq=185 Ack=359 Win=33580 Len=0 TSval=186591 TSecr=9212749"
"116","2000-03-07 12:50:03,544263","172.16.115.20","202.77.162.213","TELNET","68","Telnet Data ..."
"117","2000-03-07 12:50:03,545784","202.77.162.213","172.16.115.20","TCP","66","47496  >  23 [ACK] Seq=185 Ack=361 Win=33578 Len=0 TSval=186591 TSecr=9212751"
"118","2000-03-07 12:50:03,548410","202.77.162.213","172.16.115.20","TELNET","147","Telnet Data ..."
"119","2000-03-07 12:50:03,549020","172.16.115.20","202.77.162.213","TELNET","147","Telnet Data ..."
"120","2000-03-07 12:50:03,561661","202.77.162.213","172.16.115.20","TCP","66","47496  >  23 [ACK] Seq=266 Ack=442 Win=33580 Len=0 TSval=186591 TSecr=9212751"
"121","2000-03-07 12:50:03,573116","172.16.115.20","202.77.162.213","TCP","60","[TCP Port numbers reused] 1022  >  514 [SYN] Seq=0 Win=8760 Len=0 MSS=1460"
"122","2000-03-07 12:50:03,573263","202.77.162.213","172.16.115.20","TCP","60","514  >  1022 [SYN, ACK] Seq=0 Ack=1 Win=33580 Len=0 MSS=1460"
"123","2000-03-07 12:50:03,573463","172.16.115.20","202.77.162.213","TCP","60","1022  >  514 [ACK] Seq=1 Ack=1 Win=8760 Len=0"
"124","2000-03-07 12:50:03,573656","172.16.115.20","202.77.162.213","RSH","60","Session Establishment"
"125","2000-03-07 12:50:03,745949","202.77.162.213","172.16.115.20","TCP","60","514  >  1022 [ACK] Seq=1 Ack=2 Win=33580 Len=0"
"126","2000-03-07 12:50:03,746198","172.16.115.20","202.77.162.213","RSH","139","Session Establishment"
"127","2000-03-07 12:50:03,945924","202.77.162.213","172.16.115.20","TCP","60","514  >  1022 [ACK] Seq=1 Ack=87 Win=33580 Len=0"
"128","2000-03-07 12:50:04,631767","202.77.162.213","172.16.115.20","RSH","60","Server username:root Server -> Client Data"
"129","2000-03-07 12:50:04,631940","172.16.115.20","202.77.162.213","TCP","60","1022  >  514 [ACK] Seq=87 Ack=2 Win=8760 Len=0"
"130","2000-03-07 12:50:04,685402","202.77.162.213","172.16.115.20","RSH","105","Server username:root Server -> Client Data"
"131","2000-03-07 12:50:04,685732","172.16.115.20","202.77.162.213","TCP","60","1022  >  514 [FIN, ACK] Seq=87 Ack=53 Win=8760 Len=0"
"132","2000-03-07 12:50:04,685872","202.77.162.213","172.16.115.20","TCP","60","514  >  1022 [ACK] Seq=53 Ack=88 Win=33580 Len=0"
"133","2000-03-07 12:50:04,685975","202.77.162.213","172.16.115.20","TCP","60","514  >  1022 [FIN, ACK] Seq=53 Ack=88 Win=33580 Len=0"
"134","2000-03-07 12:50:04,686117","172.16.115.20","202.77.162.213","TCP","60","1022  >  514 [ACK] Seq=88 Ack=54 Win=8760 Len=0"
"135","2000-03-07 12:50:04,686973","172.16.115.20","202.77.162.213","TCP","60","1021  >  514 [SYN] Seq=0 Win=8760 Len=0 MSS=1460"
"136","2000-03-07 12:50:04,687145","202.77.162.213","172.16.115.20","TCP","60","514  >  1021 [SYN, ACK] Seq=0 Ack=1 Win=33580 Len=0 MSS=1460"
"137","2000-03-07 12:50:04,687310","172.16.115.20","202.77.162.213","TCP","60","1021  >  514 [ACK] Seq=1 Ack=1 Win=8760 Len=0"
"138","2000-03-07 12:50:04,687430","172.16.115.20","202.77.162.213","RSH","60","Session Establishment"
"139","2000-03-07 12:50:04,745906","202.77.162.213","172.16.115.20","TCP","60","514  >  1021 [ACK] Seq=1 Ack=2 Win=33580 Len=0"
"140","2000-03-07 12:50:04,746124","172.16.115.20","202.77.162.213","RSH","125","Session Establishment"
"141","2000-03-07 12:50:04,945861","202.77.162.213","172.16.115.20","TCP","60","514  >  1021 [ACK] Seq=1 Ack=73 Win=33580 Len=0"
"142","2000-03-07 12:50:05,807648","202.77.162.213","172.16.115.20","RSH","60","Server username:root Server -> Client Data"
"143","2000-03-07 12:50:05,807803","172.16.115.20","202.77.162.213","TCP","60","1021  >  514 [ACK] Seq=73 Ack=2 Win=8760 Len=0"
"144","2000-03-07 12:50:05,808135","172.16.115.20","202.77.162.213","RSH","60","Server username:root Client -> Server data"
"145","2000-03-07 12:50:05,867872","202.77.162.213","172.16.115.20","RSH","77","Server username:root Server -> Client Data"
"146","2000-03-07 12:50:05,869062","172.16.115.20","202.77.162.213","RSH","60","Server username:root Client -> Server data"
"147","2000-03-07 12:50:05,875962","202.77.162.213","172.16.115.20","RSH","1514","Server username:root Server -> Client Data"
"148","2000-03-07 12:50:05,877246","202.77.162.213","172.16.115.20","RSH","1514","Server username:root Server -> Client Data"
"149","2000-03-07 12:50:05,878479","202.77.162.213","172.16.115.20","RSH","1514","Server username:root Server -> Client Data"
"150","2000-03-07 12:50:05,878557","172.16.115.20","202.77.162.213","TCP","60","1021  >  514 [ACK] Seq=75 Ack=1485 Win=24820 Len=0"
"151","2000-03-07 12:50:05,879814","202.77.162.213","172.16.115.20","RSH","1514","Server username:root Server -> Client Data"
"152","2000-03-07 12:50:05,879889","172.16.115.20","202.77.162.213","TCP","60","1021  >  514 [ACK] Seq=75 Ack=2945 Win=24820 Len=0"
"153","2000-03-07 12:50:05,879988","172.16.115.20","202.77.162.213","TCP","60","1021  >  514 [ACK] Seq=75 Ack=5865 Win=24820 Len=0"
"154","2000-03-07 12:50:05,884820","202.77.162.213","172.16.115.20","RSH","1514","Server username:root Server -> Client Data"
"155","2000-03-07 12:50:05,886111","202.77.162.213","172.16.115.20","RSH","1514","Server username:root Server -> Client Data"
"156","2000-03-07 12:50:05,887330","202.77.162.213","172.16.115.20","RSH","1514","Server username:root Server -> Client Data"
"157","2000-03-07 12:50:05,887409","172.16.115.20","202.77.162.213","TCP","60","1021  >  514 [ACK] Seq=75 Ack=8785 Win=24820 Len=0"
"158","2000-03-07 12:50:05,888656","202.77.162.213","172.16.115.20","RSH","1514","Server username:root Server -> Client Data"
"159","2000-03-07 12:50:05,889896","202.77.162.213","172.16.115.20","RSH","1514","Server username:root Server -> Client Data"
"160","2000-03-07 12:50:05,889971","172.16.115.20","202.77.162.213","TCP","60","1021  >  514 [ACK] Seq=75 Ack=11705 Win=24820 Len=0"
"161","2000-03-07 12:50:05,891282","202.77.162.213","172.16.115.20","RSH","1514","Server username:root Server -> Client Data"
"162","2000-03-07 12:50:05,891465","172.16.115.20","202.77.162.213","TCP","60","1021  >  514 [ACK] Seq=75 Ack=14625 Win=24820 Len=0"
"163","2000-03-07 12:50:05,894182","202.77.162.213","172.16.115.20","RSH","1514","Server username:root Server -> Client Data"
"164","2000-03-07 12:50:05,895470","202.77.162.213","172.16.115.20","RSH","1514","Server username:root Server -> Client Data"
"165","2000-03-07 12:50:05,895643","172.16.115.20","202.77.162.213","TCP","60","1021  >  514 [ACK] Seq=75 Ack=17545 Win=24820 Len=0"
"166","2000-03-07 12:50:05,896874","202.77.162.213","172.16.115.20","RSH","1514","Server username:root Server -> Client Data"
"167","2000-03-07 12:50:05,898731","202.77.162.213","172.16.115.20","RSH","1514","Server username:root Server -> Client Data"
"168","2000-03-07 12:50:05,899964","202.77.162.213","172.16.115.20","RSH","1514","Server username:root Server -> Client Data"
"169","2000-03-07 12:50:05,900044","172.16.115.20","202.77.162.213","TCP","60","1021  >  514 [ACK] Seq=75 Ack=20465 Win=24820 Len=0"
"170","2000-03-07 12:50:05,901423","202.77.162.213","172.16.115.20","RSH","1514","Server username:root Server -> Client Data"
"171","2000-03-07 12:50:05,902647","202.77.162.213","172.16.115.20","RSH","1514","Server username:root Server -> Client Data"
"172","2000-03-07 12:50:05,902723","172.16.115.20","202.77.162.213","TCP","60","1021  >  514 [ACK] Seq=75 Ack=23385 Win=24820 Len=0"
"173","2000-03-07 12:50:05,903956","202.77.162.213","172.16.115.20","RSH","1514","Server username:root Server -> Client Data"
"174","2000-03-07 12:50:05,905295","202.77.162.213","172.16.115.20","RSH","1514","Server username:root Server -> Client Data"
"175","2000-03-07 12:50:05,905373","172.16.115.20","202.77.162.213","TCP","60","1021  >  514 [ACK] Seq=75 Ack=26305 Win=24820 Len=0"
"176","2000-03-07 12:50:05,906606","202.77.162.213","172.16.115.20","RSH","1514","Server username:root Server -> Client Data"
"177","2000-03-07 12:50:05,907848","202.77.162.213","172.16.115.20","RSH","1514","Server username:root Server -> Client Data"
"178","2000-03-07 12:50:05,907916","172.16.115.20","202.77.162.213","TCP","60","1021  >  514 [ACK] Seq=75 Ack=29225 Win=24820 Len=0"
"179","2000-03-07 12:50:05,909312","202.77.162.213","172.16.115.20","RSH","1514","Server username:root Server -> Client Data"
"180","2000-03-07 12:50:05,910544","202.77.162.213","172.16.115.20","RSH","1514","Server username:root Server -> Client Data"
"181","2000-03-07 12:50:05,911775","202.77.162.213","172.16.115.20","RSH","1514","Server username:root Server -> Client Data"
"182","2000-03-07 12:50:05,911880","172.16.115.20","202.77.162.213","TCP","60","1021  >  514 [ACK] Seq=75 Ack=32145 Win=24820 Len=0"
"183","2000-03-07 12:50:05,913111","202.77.162.213","172.16.115.20","RSH","1514","Server username:root Server -> Client Data"
"184","2000-03-07 12:50:05,913192","172.16.115.20","202.77.162.213","TCP","60","1021  >  514 [ACK] Seq=75 Ack=35065 Win=24820 Len=0"
"185","2000-03-07 12:50:05,916205","202.77.162.213","172.16.115.20","RSH","1514","Server username:root Server -> Client Data"
"186","2000-03-07 12:50:05,917477","202.77.162.213","172.16.115.20","RSH","1514","Server username:root Server -> Client Data"
"187","2000-03-07 12:50:05,917556","172.16.115.20","202.77.162.213","TCP","60","1021  >  514 [ACK] Seq=75 Ack=37985 Win=24820 Len=0"
"188","2000-03-07 12:50:05,918881","202.77.162.213","172.16.115.20","RSH","1514","Server username:root Server -> Client Data"
"189","2000-03-07 12:50:05,920116","202.77.162.213","172.16.115.20","RSH","1514","Server username:root Server -> Client Data"
"190","2000-03-07 12:50:05,920190","172.16.115.20","202.77.162.213","TCP","60","1021  >  514 [ACK] Seq=75 Ack=40905 Win=24820 Len=0"
"191","2000-03-07 12:50:05,921423","202.77.162.213","172.16.115.20","RSH","1514","Server username:root Server -> Client Data"
"192","2000-03-07 12:50:05,922668","202.77.162.213","172.16.115.20","RSH","1514","Server username:root Server -> Client Data"
"193","2000-03-07 12:50:05,923887","202.77.162.213","172.16.115.20","RSH","1514","Server username:root Server -> Client Data"
"194","2000-03-07 12:50:05,923967","172.16.115.20","202.77.162.213","TCP","60","1021  >  514 [ACK] Seq=75 Ack=43825 Win=24820 Len=0"
"195","2000-03-07 12:50:05,925198","202.77.162.213","172.16.115.20","RSH","1514","Server username:root Server -> Client Data"
"196","2000-03-07 12:50:05,925276","172.16.115.20","202.77.162.213","TCP","60","1021  >  514 [ACK] Seq=75 Ack=46745 Win=24820 Len=0"
"197","2000-03-07 12:50:05,926681","202.77.162.213","172.16.115.20","RSH","1514","Server username:root Server -> Client Data"
"198","2000-03-07 12:50:05,927912","202.77.162.213","172.16.115.20","RSH","1514","Server username:root Server -> Client Data"
"199","2000-03-07 12:50:05,927992","172.16.115.20","202.77.162.213","TCP","60","1021  >  514 [ACK] Seq=75 Ack=49665 Win=24820 Len=0"
"200","2000-03-07 12:50:05,929234","202.77.162.213","172.16.115.20","RSH","1514","Server username:root Server -> Client Data"
"201","2000-03-07 12:50:05,930459","202.77.162.213","172.16.115.20","RSH","1514","Server username:root Server -> Client Data"
"202","2000-03-07 12:50:05,930534","172.16.115.20","202.77.162.213","TCP","60","1021  >  514 [ACK] Seq=75 Ack=52585 Win=24820 Len=0"
"203","2000-03-07 12:50:05,931886","202.77.162.213","172.16.115.20","RSH","1514","Server username:root Server -> Client Data"
"204","2000-03-07 12:50:05,933130","202.77.162.213","172.16.115.20","RSH","1514","Server username:root Server -> Client Data"
"205","2000-03-07 12:50:05,933208","172.16.115.20","202.77.162.213","TCP","60","1021  >  514 [ACK] Seq=75 Ack=55505 Win=24820 Len=0"
"206","2000-03-07 12:50:05,934483","202.77.162.213","172.16.115.20","RSH","1514","Server username:root Server -> Client Data"
"207","2000-03-07 12:50:05,934668","172.16.115.20","202.77.162.213","TCP","60","1021  >  514 [ACK] Seq=75 Ack=58425 Win=24820 Len=0"
"208","2000-03-07 12:50:05,937759","202.77.162.213","172.16.115.20","RSH","1003","Server username:root Server -> Client Data"
"209","2000-03-07 12:50:05,938298","172.16.115.20","202.77.162.213","RSH","60","Server username:root Client -> Server data"
"210","2000-03-07 12:50:05,940397","202.77.162.213","172.16.115.20","TCP","60","514  >  1021 [FIN, ACK] Seq=59374 Ack=76 Win=33580 Len=0"
"211","2000-03-07 12:50:05,940534","172.16.115.20","202.77.162.213","TCP","60","1021  >  514 [ACK] Seq=76 Ack=59375 Win=24820 Len=0"
"212","2000-03-07 12:50:05,940719","172.16.115.20","202.77.162.213","TCP","60","1021  >  514 [FIN, ACK] Seq=76 Ack=59375 Win=24820 Len=0"
"213","2000-03-07 12:50:05,940840","202.77.162.213","172.16.115.20","TCP","60","514  >  1021 [ACK] Seq=59375 Ack=77 Win=33580 Len=0"
"214","2000-03-07 12:50:05,943722","172.16.115.20","202.77.162.213","TELNET","68","Telnet Data ..."
"215","2000-03-07 12:50:05,945783","202.77.162.213","172.16.115.20","TCP","66","47496  >  23 [ACK] Seq=266 Ack=444 Win=33578 Len=0 TSval=186596 TSecr=9212991"
"216","2000-03-07 12:50:05,948977","202.77.162.213","172.16.115.20","TELNET","88","Telnet Data ..."
"217","2000-03-07 12:50:05,949335","172.16.115.20","202.77.162.213","TELNET","88","Telnet Data ..."
"218","2000-03-07 12:50:05,961844","202.77.162.213","172.16.115.20","TCP","66","47496  >  23 [ACK] Seq=288 Ack=466 Win=33580 Len=0 TSval=186596 TSecr=9212991"
"219","2000-03-07 12:50:05,962648","172.16.115.20","202.77.162.213","TELNET","68","Telnet Data ..."
"220","2000-03-07 12:50:05,966635","202.77.162.213","172.16.115.20","TELNET","93","Telnet Data ..."
"221","2000-03-07 12:50:05,967033","172.16.115.20","202.77.162.213","TELNET","93","Telnet Data ..."
"222","2000-03-07 12:50:05,971029","202.77.162.213","172.16.115.20","TELNET","72","Telnet Data ..."
"223","2000-03-07 12:50:05,971236","172.16.115.20","202.77.162.213","TELNET","68","Telnet Data ..."
"224","2000-03-07 12:50:05,991907","202.77.162.213","172.16.115.20","TCP","66","47496  >  23 [ACK] Seq=321 Ack=497 Win=33580 Len=0 TSval=186596 TSecr=9212993"
"225","2000-03-07 12:50:05,992140","172.16.115.20","202.77.162.213","TELNET","72","Telnet Data ..."
"226","2000-03-07 12:50:05,998056","172.16.115.20","202.77.162.213","TCP","66","23  >  47496 [FIN, ACK] Seq=503 Ack=321 Win=10136 Len=0 TSval=9212996 TSecr=186596"
"227","2000-03-07 12:50:05,998220","202.77.162.213","172.16.115.20","TCP","66","47496  >  23 [ACK] Seq=321 Ack=504 Win=33574 Len=0 TSval=186596 TSecr=9212995"
"228","2000-03-07 12:50:06,002665","202.77.162.213","172.16.115.20","TCP","74","1023  >  514 [SYN] Seq=0 Win=32768 Len=0 MSS=1460 WS=1 TSval=186596 TSecr=0"
"229","2000-03-07 12:50:06,002926","172.16.115.20","202.77.162.213","TCP","74","514  >  1023 [SYN, ACK] Seq=0 Ack=1 Win=10136 Len=0 TSval=9212996 TSecr=186596 WS=1 MSS=1460"
"230","2000-03-07 12:50:06,003002","202.77.162.213","172.16.115.20","TCP","66","47496  >  23 [FIN, ACK] Seq=321 Ack=504 Win=33574 Len=0 TSval=186596 TSecr=9212995"
"231","2000-03-07 12:50:06,003075","202.77.162.213","172.16.115.20","TCP","66","1023  >  514 [ACK] Seq=1 Ack=1 Win=33580 Len=0 TSval=186596 TSecr=9212996"
"232","2000-03-07 12:50:06,003159","172.16.115.20","202.77.162.213","TCP","66","23  >  47496 [ACK] Seq=504 Ack=322 Win=10136 Len=0 TSval=9212996 TSecr=186596"
"233","2000-03-07 12:50:06,004074","202.77.162.213","172.16.115.20","RSH","71","Session Establishment"
"234","2000-03-07 12:50:06,004206","172.16.115.20","202.77.162.213","TCP","66","514  >  1023 [ACK] Seq=1 Ack=6 Win=10131 Len=0 TSval=9212997 TSecr=186596"
"235","2000-03-07 12:50:07,044505","172.16.115.20","202.77.162.213","TCP","60","1021  >  1022 [SYN] Seq=0 Win=8760 Len=0 MSS=1460"
"236","2000-03-07 12:50:07,044671","202.77.162.213","172.16.115.20","TCP","60","1022  >  1021 [SYN, ACK] Seq=0 Ack=1 Win=33580 Len=0 MSS=1460"
"237","2000-03-07 12:50:07,044856","172.16.115.20","202.77.162.213","TCP","60","1021  >  1022 [ACK] Seq=1 Ack=1 Win=8760 Len=0"
"238","2000-03-07 12:50:07,048062","202.77.162.213","172.16.115.20","RSH","71","Session Establishment"
"239","2000-03-07 12:50:07,048249","172.16.115.20","202.77.162.213","TCP","66","514  >  1023 [ACK] Seq=1 Ack=11 Win=10136 Len=0 TSval=9213101 TSecr=186598"
"240","2000-03-07 12:50:07,147125","202.77.162.213","172.16.115.20","RSH","99","Session Establishment"
"241","2000-03-07 12:50:07,165621","172.16.115.20","202.77.162.213","RSH","67","Server username:hacker2 Server -> Client Data"
"242","2000-03-07 12:50:07,167991","202.77.162.213","172.16.115.20","TCP","66","1023  >  514 [FIN, ACK] Seq=44 Ack=2 Win=33580 Len=0 TSval=186598 TSecr=9213113"
"243","2000-03-07 12:50:07,168190","172.16.115.20","202.77.162.213","TCP","66","514  >  1023 [ACK] Seq=2 Ack=45 Win=10136 Len=0 TSval=9213113 TSecr=186598"
"244","2000-03-07 12:50:07,241430","172.16.115.20","202.77.162.213","RSH","99","Server username:hacker2 Server -> Client Data"
"245","2000-03-07 12:50:07,241571","202.77.162.213","172.16.115.20","TCP","60","1023  >  514 [RST] Seq=45 Win=0 Len=0"
"246","2000-03-07 12:50:21,014549","202.77.162.213","172.16.112.10","TCP","74","47502  >  23 [SYN] Seq=0 Win=32768 Len=0 MSS=1460 WS=1 TSval=186626 TSecr=0"
"247","2000-03-07 12:50:21,014895","172.16.112.10","202.77.162.213","TCP","58","23  >  47502 [SYN, ACK] Seq=0 Ack=1 Win=8760 Len=0 MSS=1460"
"248","2000-03-07 12:50:21,015179","202.77.162.213","172.16.112.10","TCP","60","47502  >  23 [ACK] Seq=1 Ack=1 Win=33580 Len=0"
"249","2000-03-07 12:50:21,023885","202.77.162.213","172.16.115.20","TCP","74","[TCP Port numbers reused] 1023  >  514 [SYN] Seq=0 Win=32768 Len=0 MSS=1460 WS=1 TSval=186626 TSecr=0"
"250","2000-03-07 12:50:21,024169","172.16.115.20","202.77.162.213","TCP","74","514  >  1023 [SYN, ACK] Seq=0 Ack=1 Win=10136 Len=0 TSval=9214499 TSecr=186626 WS=1 MSS=1460"
"251","2000-03-07 12:50:21,024323","202.77.162.213","172.16.115.20","TCP","66","1023  >  514 [ACK] Seq=1 Ack=1 Win=33580 Len=0 TSval=186626 TSecr=9214499"
"252","2000-03-07 12:50:21,024782","202.77.162.213","172.16.115.20","RSH","71","Session Establishment"
"253","2000-03-07 12:50:21,025052","172.16.115.20","202.77.162.213","TCP","66","514  >  1023 [ACK] Seq=1 Ack=6 Win=10136 Len=0 TSval=9214499 TSecr=186626"
"254","2000-03-07 12:50:21,064056","172.16.112.10","202.77.162.213","TELNET","69","Telnet Data ..."
"255","2000-03-07 12:50:21,067291","202.77.162.213","172.16.112.10","TELNET","69","Telnet Data ..."
"256","2000-03-07 12:50:21,068754","172.16.112.10","202.77.162.213","TELNET","117","Telnet Data ..."
"257","2000-03-07 12:50:21,072217","172.16.115.20","202.77.162.213","TCP","60","1020  >  1022 [SYN] Seq=0 Win=8760 Len=0 MSS=1460"
"258","2000-03-07 12:50:21,072352","202.77.162.213","172.16.115.20","TCP","60","1022  >  1020 [SYN, ACK] Seq=0 Ack=1 Win=33580 Len=0 MSS=1460"
"259","2000-03-07 12:50:21,072556","172.16.115.20","202.77.162.213","TCP","60","1020  >  1022 [ACK] Seq=1 Ack=1 Win=8760 Len=0"
"260","2000-03-07 12:50:21,082074","202.77.162.213","172.16.112.10","TCP","60","47502  >  23 [ACK] Seq=16 Ack=79 Win=33580 Len=0"
"261","2000-03-07 12:50:21,105705","172.16.112.10","202.77.162.213","TELNET","63","Telnet Data ..."
"262","2000-03-07 12:50:21,108405","202.77.162.213","172.16.112.10","TELNET","63","Telnet Data ..."
"263","2000-03-07 12:50:21,108478","172.16.112.10","202.77.162.213","TELNET","61","Telnet Data ..."
"264","2000-03-07 12:50:21,110795","202.77.162.213","172.16.112.10","TELNET","63","Telnet Data ..."
"265","2000-03-07 12:50:21,110976","172.16.112.10","202.77.162.213","TELNET","57","Telnet Data ..."
"266","2000-03-07 12:50:21,132065","202.77.162.213","172.16.112.10","TCP","60","47502  >  23 [ACK] Seq=34 Ack=98 Win=33580 Len=0"
"267","2000-03-07 12:50:21,132150","172.16.112.10","202.77.162.213","TELNET","73","Telnet Data ..."
"268","2000-03-07 12:50:21,134326","202.77.162.213","172.16.112.10","TELNET","63","Telnet Data ..."
"269","2000-03-07 12:50:21,134871","172.16.112.10","202.77.162.213","TELNET","56","Telnet Data ..."
"270","2000-03-07 12:50:21,144906","202.77.162.213","172.16.112.10","TCP","60","47502  >  23 [ACK] Seq=43 Ack=119 Win=33578 Len=0"
"271","2000-03-07 12:50:21,146414","202.77.162.213","172.16.115.20","RSH","118","Session Establishment"
"272","2000-03-07 12:50:21,158600","172.16.112.10","202.77.162.213","TELNET","109","Telnet Data ..."
"273","2000-03-07 12:50:21,165076","172.16.115.20","202.77.162.213","RSH","67","Server username:hacker2 Server -> Client Data"
"274","2000-03-07 12:50:21,167574","202.77.162.213","172.16.115.20","TCP","66","1023  >  514 [FIN, ACK] Seq=58 Ack=2 Win=33580 Len=0 TSval=186626 TSecr=9214513"
"275","2000-03-07 12:50:21,167759","172.16.115.20","202.77.162.213","TCP","66","514  >  1023 [ACK] Seq=2 Ack=59 Win=10136 Len=0 TSval=9214513 TSecr=186626"
"276","2000-03-07 12:50:21,172015","202.77.162.213","172.16.112.10","TCP","60","47502  >  23 [ACK] Seq=43 Ack=174 Win=33580 Len=0"
"277","2000-03-07 12:50:21,221946","172.16.112.10","202.77.162.213","TELNET","117","Telnet Data ..."
"278","2000-03-07 12:50:21,229436","172.16.115.20","255.255.255.255","UDP","60","33786  >  9325 Len=9"
"279","2000-03-07 12:50:21,232535","172.16.115.20","202.77.162.213","RSH","124","Server username:hacker2 Server -> Client Data"
"280","2000-03-07 12:50:21,232649","202.77.162.213","172.16.115.20","TCP","60","1023  >  514 [RST] Seq=59 Win=0 Len=0"
"281","2000-03-07 12:50:21,242006","202.77.162.213","172.16.112.10","TCP","60","47502  >  23 [ACK] Seq=43 Ack=237 Win=33580 Len=0"
"282","2000-03-07 12:50:21,249407","172.16.112.10","202.77.162.213","TELNET","56","Telnet Data ..."
"283","2000-03-07 12:50:21,252770","202.77.162.213","172.16.112.10","TELNET","75","Telnet Data ..."
"284","2000-03-07 12:50:21,253059","172.16.112.10","202.77.162.213","TELNET","75","Telnet Data ..."
"285","2000-03-07 12:50:21,272046","202.77.162.213","172.16.112.10","TCP","60","47502  >  23 [ACK] Seq=64 Ack=260 Win=33580 Len=0"
"286","2000-03-07 12:50:21,272155","172.16.112.10","202.77.162.213","TELNET","56","Telnet Data ..."
"287","2000-03-07 12:50:21,276705","202.77.162.213","172.16.112.10","TELNET","72","Telnet Data ..."
"288","2000-03-07 12:50:21,276988","172.16.112.10","202.77.162.213","TELNET","72","Telnet Data ..."
"289","2000-03-07 12:50:21,292015","202.77.162.213","172.16.112.10","TCP","60","47502  >  23 [ACK] Seq=82 Ack=280 Win=33580 Len=0"
"290","2000-03-07 12:50:21,292110","172.16.112.10","202.77.162.213","TELNET","56","Telnet Data ..."
"291","2000-03-07 12:50:21,296348","202.77.162.213","172.16.112.10","TELNET","135","Telnet Data ..."
"292","2000-03-07 12:50:21,296865","172.16.112.10","202.77.162.213","TELNET","135","Telnet Data ..."
"293","2000-03-07 12:50:21,312062","202.77.162.213","172.16.112.10","TCP","60","47502  >  23 [ACK] Seq=163 Ack=363 Win=33580 Len=0"
"294","2000-03-07 12:50:21,322008","172.16.112.10","202.77.162.213","TCP","58","1023  >  514 [SYN] Seq=0 Win=8760 Len=0 MSS=1460"
"295","2000-03-07 12:50:21,322343","202.77.162.213","172.16.112.10","TCP","60","514  >  1023 [SYN, ACK] Seq=0 Ack=1 Win=33580 Len=0 MSS=1460"
"296","2000-03-07 12:50:21,322436","172.16.112.10","202.77.162.213","TCP","54","1023  >  514 [ACK] Seq=1 Ack=1 Win=8760 Len=0"
"297","2000-03-07 12:50:21,322651","172.16.112.10","202.77.162.213","RSH","55","Session Establishment"
"298","2000-03-07 12:50:21,344873","202.77.162.213","172.16.112.10","TCP","60","514  >  1023 [ACK] Seq=1 Ack=2 Win=33580 Len=0"
"299","2000-03-07 12:50:21,344974","172.16.112.10","202.77.162.213","RSH","139","Session Establishment"
"300","2000-03-07 12:50:21,444378","202.77.162.213","172.16.112.10","RSH","60","Server username:root Server -> Client Data"
"301","2000-03-07 12:50:21,492943","172.16.112.10","202.77.162.213","TCP","54","1023  >  514 [ACK] Seq=87 Ack=2 Win=8760 Len=0"
"302","2000-03-07 12:50:21,497987","202.77.162.213","172.16.112.10","RSH","105","Server username:root Server -> Client Data"
"303","2000-03-07 12:50:21,498308","172.16.112.10","202.77.162.213","TCP","54","1023  >  514 [FIN, ACK] Seq=87 Ack=53 Win=8760 Len=0"
"304","2000-03-07 12:50:21,498535","202.77.162.213","172.16.112.10","TCP","60","514  >  1023 [FIN, ACK] Seq=53 Ack=87 Win=33580 Len=0"
"305","2000-03-07 12:50:21,498757","202.77.162.213","172.16.112.10","TCP","60","[TCP Retransmission] 514  >  1023 [FIN, ACK] Seq=53 Ack=88 Win=33580 Len=0"
"306","2000-03-07 12:50:21,498867","172.16.112.10","202.77.162.213","TCP","54","1023  >  514 [ACK] Seq=88 Ack=54 Win=8760 Len=0"
"307","2000-03-07 12:50:21,498957","172.16.112.10","202.77.162.213","TCP","54","[TCP Dup ACK 306#1] 1023  >  514 [ACK] Seq=88 Ack=54 Win=8760 Len=0"
"308","2000-03-07 12:50:21,500077","172.16.112.10","202.77.162.213","TCP","58","1022  >  514 [SYN] Seq=0 Win=8760 Len=0 MSS=1460"
"309","2000-03-07 12:50:21,500395","202.77.162.213","172.16.112.10","TCP","60","514  >  1022 [SYN, ACK] Seq=0 Ack=1 Win=33580 Len=0 MSS=1460"
"310","2000-03-07 12:50:21,500483","172.16.112.10","202.77.162.213","TCP","54","1022  >  514 [ACK] Seq=1 Ack=1 Win=8760 Len=0"
"311","2000-03-07 12:50:21,500677","172.16.112.10","202.77.162.213","RSH","55","Session Establishment"
"312","2000-03-07 12:50:21,544825","202.77.162.213","172.16.112.10","TCP","60","514  >  1022 [ACK] Seq=1 Ack=2 Win=33580 Len=0"
"313","2000-03-07 12:50:21,544941","172.16.112.10","202.77.162.213","RSH","125","Session Establishment"
"314","2000-03-07 12:50:21,733088","172.16.112.10","202.77.162.213","TCP","125","[TCP Retransmission] 1022  >  514 [PSH, ACK] Seq=2 Ack=1 Win=8760 Len=71"
"315","2000-03-07 12:50:21,733395","202.77.162.213","172.16.112.10","TCP","60","514  >  1022 [ACK] Seq=1 Ack=73 Win=33580 Len=0"
"316","2000-03-07 12:50:22,612369","202.77.162.213","172.16.112.10","RSH","60","Server username:root Server -> Client Data"
"317","2000-03-07 12:50:22,612651","172.16.112.10","202.77.162.213","RSH","55","Server username:root Client -> Server data"
"318","2000-03-07 12:50:22,671087","202.77.162.213","172.16.112.10","RSH","77","Server username:root Server -> Client Data"
"319","2000-03-07 12:50:22,671802","172.16.112.10","202.77.162.213","RSH","55","Server username:root Client -> Server data"
"320","2000-03-07 12:50:22,678973","202.77.162.213","172.16.112.10","RSH","1514","Server username:root Server -> Client Data"
"321","2000-03-07 12:50:22,679025","172.16.112.10","202.77.162.213","TCP","54","1022  >  514 [ACK] Seq=75 Ack=1485 Win=24820 Len=0"
"322","2000-03-07 12:50:22,680211","202.77.162.213","172.16.112.10","RSH","1514","Server username:root Server -> Client Data"
"323","2000-03-07 12:50:22,681454","202.77.162.213","172.16.112.10","RSH","1514","Server username:root Server -> Client Data"
"324","2000-03-07 12:50:22,681504","172.16.112.10","202.77.162.213","TCP","54","1022  >  514 [ACK] Seq=75 Ack=4405 Win=24820 Len=0"
"325","2000-03-07 12:50:22,682753","202.77.162.213","172.16.112.10","RSH","1514","Server username:root Server -> Client Data"
"326","2000-03-07 12:50:22,687750","202.77.162.213","172.16.112.10","RSH","1514","Server username:root Server -> Client Data"
"327","2000-03-07 12:50:22,689056","202.77.162.213","172.16.112.10","RSH","1514","Server username:root Server -> Client Data"
"328","2000-03-07 12:50:22,689099","172.16.112.10","202.77.162.213","TCP","54","1022  >  514 [ACK] Seq=75 Ack=8785 Win=24820 Len=0"
"329","2000-03-07 12:50:22,690265","202.77.162.213","172.16.112.10","RSH","1514","Server username:root Server -> Client Data"
"330","2000-03-07 12:50:22,691583","202.77.162.213","172.16.112.10","RSH","1514","Server username:root Server -> Client Data"
"331","2000-03-07 12:50:22,692811","202.77.162.213","172.16.112.10","RSH","1514","Server username:root Server -> Client Data"
"332","2000-03-07 12:50:22,694141","202.77.162.213","172.16.112.10","RSH","1514","Server username:root Server -> Client Data"
"333","2000-03-07 12:50:22,694209","172.16.112.10","202.77.162.213","TCP","54","1022  >  514 [ACK] Seq=75 Ack=14625 Win=24820 Len=0"
"334","2000-03-07 12:50:22,697112","202.77.162.213","172.16.112.10","RSH","1514","Server username:root Server -> Client Data"
"335","2000-03-07 12:50:22,698378","202.77.162.213","172.16.112.10","RSH","1514","Server username:root Server -> Client Data"
"336","2000-03-07 12:50:22,699618","202.77.162.213","172.16.112.10","RSH","1514","Server username:root Server -> Client Data"
"337","2000-03-07 12:50:22,702766","202.77.162.213","172.16.112.10","RSH","1514","Server username:root Server -> Client Data"
"338","2000-03-07 12:50:22,704031","202.77.162.213","172.16.112.10","RSH","1514","Server username:root Server -> Client Data"
"339","2000-03-07 12:50:22,704141","172.16.112.10","202.77.162.213","TCP","54","1022  >  514 [ACK] Seq=75 Ack=21925 Win=24820 Len=0"
"340","2000-03-07 12:50:22,705382","202.77.162.213","172.16.112.10","RSH","1514","Server username:root Server -> Client Data"
"341","2000-03-07 12:50:22,706604","202.77.162.213","172.16.112.10","RSH","1514","Server username:root Server -> Client Data"
"342","2000-03-07 12:50:22,707929","202.77.162.213","172.16.112.10","RSH","1514","Server username:root Server -> Client Data"
"343","2000-03-07 12:50:22,709316","202.77.162.213","172.16.112.10","RSH","1514","Server username:root Server -> Client Data"
"344","2000-03-07 12:50:22,710585","202.77.162.213","172.16.112.10","RSH","1514","Server username:root Server -> Client Data"
"345","2000-03-07 12:50:22,711849","202.77.162.213","172.16.112.10","RSH","1514","Server username:root Server -> Client Data"
"346","2000-03-07 12:50:22,711894","172.16.112.10","202.77.162.213","TCP","54","1022  >  514 [ACK] Seq=75 Ack=30685 Win=24820 Len=0"
"347","2000-03-07 12:50:22,713197","202.77.162.213","172.16.112.10","RSH","1514","Server username:root Server -> Client Data"
"348","2000-03-07 12:50:22,714410","202.77.162.213","172.16.112.10","RSH","1514","Server username:root Server -> Client Data"
"349","2000-03-07 12:50:22,715726","202.77.162.213","172.16.112.10","RSH","1514","Server username:root Server -> Client Data"
"350","2000-03-07 12:50:22,716954","202.77.162.213","172.16.112.10","RSH","1514","Server username:root Server -> Client Data"
"351","2000-03-07 12:50:22,718237","202.77.162.213","172.16.112.10","RSH","1514","Server username:root Server -> Client Data"
"352","2000-03-07 12:50:22,719578","202.77.162.213","172.16.112.10","RSH","1514","Server username:root Server -> Client Data"
"353","2000-03-07 12:50:22,720887","202.77.162.213","172.16.112.10","RSH","1514","Server username:root Server -> Client Data"
"354","2000-03-07 12:50:22,720932","172.16.112.10","202.77.162.213","TCP","54","1022  >  514 [ACK] Seq=75 Ack=40905 Win=24820 Len=0"
"355","2000-03-07 12:50:22,722126","202.77.162.213","172.16.112.10","RSH","1514","Server username:root Server -> Client Data"
"356","2000-03-07 12:50:22,723664","202.77.162.213","172.16.112.10","RSH","1514","Server username:root Server -> Client Data"
"357","2000-03-07 12:50:22,773292","172.16.112.10","202.77.162.213","TCP","54","1022  >  514 [ACK] Seq=75 Ack=43825 Win=24820 Len=0"
"358","2000-03-07 12:50:22,773859","202.77.162.213","172.16.112.10","RSH","431","Server username:root Server -> Client Data"
"359","2000-03-07 12:50:22,774211","172.16.112.10","202.77.162.213","RSH","55","Server username:root Client -> Server data"
"360","2000-03-07 12:50:22,776533","202.77.162.213","172.16.112.10","TCP","60","514  >  1022 [FIN, ACK] Seq=44202 Ack=76 Win=33580 Len=0"
"361","2000-03-07 12:50:22,776578","172.16.112.10","202.77.162.213","TCP","54","1022  >  514 [ACK] Seq=76 Ack=44203 Win=24820 Len=0"
"362","2000-03-07 12:50:22,776874","172.16.112.10","202.77.162.213","TCP","54","1022  >  514 [FIN, ACK] Seq=76 Ack=44203 Win=24820 Len=0"
"363","2000-03-07 12:50:22,777150","202.77.162.213","172.16.112.10","TCP","60","514  >  1022 [ACK] Seq=44203 Ack=77 Win=33580 Len=0"
"364","2000-03-07 12:50:22,779125","172.16.112.10","202.77.162.213","TELNET","56","Telnet Data ..."
"365","2000-03-07 12:50:22,784385","202.77.162.213","172.16.112.10","TELNET","76","Telnet Data ..."
"366","2000-03-07 12:50:22,784676","172.16.112.10","202.77.162.213","TELNET","76","Telnet Data ..."
"367","2000-03-07 12:50:22,802170","202.77.162.213","172.16.112.10","TCP","60","47502  >  23 [ACK] Seq=185 Ack=387 Win=33580 Len=0"
"368","2000-03-07 12:50:22,802245","172.16.112.10","202.77.162.213","TELNET","56","Telnet Data ..."
"369","2000-03-07 12:50:22,806277","202.77.162.213","172.16.112.10","TELNET","81","Telnet Data ..."
"370","2000-03-07 12:50:22,806556","172.16.112.10","202.77.162.213","TELNET","81","Telnet Data ..."
"371","2000-03-07 12:50:22,810724","202.77.162.213","172.16.112.10","TELNET","60","Telnet Data ..."
"372","2000-03-07 12:50:22,810885","172.16.112.10","202.77.162.213","TELNET","56","Telnet Data ..."
"373","2000-03-07 12:50:22,832202","202.77.162.213","172.16.112.10","TCP","60","47502  >  23 [ACK] Seq=218 Ack=418 Win=33580 Len=0"
"374","2000-03-07 12:50:22,832284","172.16.112.10","202.77.162.213","TELNET","60","Telnet Data ..."
"375","2000-03-07 12:50:22,832563","202.77.162.213","172.16.112.10","TCP","60","47502  >  23 [ACK] Seq=218 Ack=425 Win=33574 Len=0"
"376","2000-03-07 12:50:22,833220","202.77.162.213","172.16.112.10","TCP","60","47502  >  23 [FIN, ACK] Seq=218 Ack=425 Win=33574 Len=0"
"377","2000-03-07 12:50:22,833272","172.16.112.10","202.77.162.213","TCP","54","23  >  47502 [ACK] Seq=425 Ack=219 Win=8760 Len=0"
"378","2000-03-07 12:50:37,844722","202.77.162.213","172.16.112.50","TCP","74","47512  >  23 [SYN] Seq=0 Win=32768 Len=0 MSS=1460 WS=1 TSval=186660 TSecr=0"
"379","2000-03-07 12:50:37,845021","172.16.112.50","202.77.162.213","TCP","60","23  >  47512 [SYN, ACK] Seq=0 Ack=1 Win=8760 Len=0 MSS=1460"
"380","2000-03-07 12:50:37,845172","202.77.162.213","172.16.112.50","TCP","60","47512  >  23 [ACK] Seq=1 Ack=1 Win=33580 Len=0"
"381","2000-03-07 12:50:37,858457","202.77.162.213","172.16.112.10","TCP","74","1023  >  514 [SYN] Seq=0 Win=32768 Len=0 MSS=1460 WS=1 TSval=186660 TSecr=0"
"382","2000-03-07 12:50:37,858702","172.16.112.10","202.77.162.213","TCP","58","514  >  1023 [SYN, ACK] Seq=0 Ack=1 Win=8760 Len=0 MSS=1460"
"383","2000-03-07 12:50:37,858971","202.77.162.213","172.16.112.10","TCP","60","1023  >  514 [ACK] Seq=1 Ack=1 Win=33580 Len=0"
"384","2000-03-07 12:50:37,859596","202.77.162.213","172.16.112.10","RSH","60","Session Establishment"
"385","2000-03-07 12:50:37,891890","172.16.112.10","202.77.162.213","TCP","58","1022  >  1022 [SYN] Seq=0 Win=8760 Len=0 MSS=1460"
"386","2000-03-07 12:50:37,892207","202.77.162.213","172.16.112.10","TCP","60","1022  >  1022 [SYN, ACK] Seq=0 Ack=1 Win=33580 Len=0 MSS=1460"
"387","2000-03-07 12:50:37,892294","172.16.112.10","202.77.162.213","TCP","54","1022  >  1022 [ACK] Seq=1 Ack=1 Win=8760 Len=0"
"388","2000-03-07 12:50:37,906434","172.16.112.10","202.77.162.213","TCP","54","514  >  1023 [ACK] Seq=1 Ack=6 Win=8760 Len=0"
"389","2000-03-07 12:50:37,923074","172.16.112.50","202.77.162.213","TELNET","69","Telnet Data ..."
"390","2000-03-07 12:50:37,926362","202.77.162.213","172.16.112.50","TELNET","69","Telnet Data ..."
"391","2000-03-07 12:50:37,929006","172.16.112.50","202.77.162.213","TELNET","118","Telnet Data ..."
"392","2000-03-07 12:50:37,942264","202.77.162.213","172.16.112.50","TCP","60","47512  >  23 [ACK] Seq=16 Ack=80 Win=33580 Len=0"
"393","2000-03-07 12:50:37,945532","202.77.162.213","172.16.112.10","RSH","106","Session Establishment"
"394","2000-03-07 12:50:37,960964","172.16.112.10","202.77.162.213","RSH","55","Server username:hacker2 Server -> Client Data"
"395","2000-03-07 12:50:37,963663","202.77.162.213","172.16.112.10","TCP","60","1023  >  514 [FIN, ACK] Seq=58 Ack=2 Win=33580 Len=0"
"396","2000-03-07 12:50:37,963731","172.16.112.10","202.77.162.213","TCP","54","514  >  1023 [ACK] Seq=2 Ack=59 Win=8760 Len=0"
"397","2000-03-07 12:50:37,978332","172.16.112.50","202.77.162.213","TELNET","63","Telnet Data ..."
"398","2000-03-07 12:50:37,981020","202.77.162.213","172.16.112.50","TELNET","63","Telnet Data ..."
"399","2000-03-07 12:50:37,981224","172.16.112.50","202.77.162.213","TELNET","61","Telnet Data ..."
"400","2000-03-07 12:50:37,983486","202.77.162.213","172.16.112.50","TELNET","63","Telnet Data ..."
"401","2000-03-07 12:50:37,983654","172.16.112.50","202.77.162.213","TELNET","60","Telnet Data ..."
"402","2000-03-07 12:50:38,002249","202.77.162.213","172.16.112.50","TCP","60","47512  >  23 [ACK] Seq=34 Ack=99 Win=33580 Len=0"
"403","2000-03-07 12:50:38,002432","172.16.112.50","202.77.162.213","TELNET","73","Telnet Data ..."
"404","2000-03-07 12:50:38,004472","202.77.162.213","172.16.112.50","TELNET","63","Telnet Data ..."
"405","2000-03-07 12:50:38,005228","172.16.112.50","202.77.162.213","TELNET","60","Telnet Data ..."
"406","2000-03-07 12:50:38,007505","172.16.112.10","255.255.255.255","UDP","51","32826  >  9325 Len=9"
"407","2000-03-07 12:50:38,008349","172.16.112.10","202.77.162.213","RSH","112","Server username:hacker2 Server -> Client Data"
"408","2000-03-07 12:50:38,008869","202.77.162.213","172.16.112.10","TCP","60","1023  >  514 [RST] Seq=59 Win=0 Len=0"
"409","2000-03-07 12:50:38,022228","202.77.162.213","172.16.112.50","TCP","60","47512  >  23 [ACK] Seq=43 Ack=120 Win=33580 Len=0"
"410","2000-03-07 12:50:38,066324","172.16.112.50","202.77.162.213","TELNET","109","Telnet Data ..."
"411","2000-03-07 12:50:38,082213","202.77.162.213","172.16.112.50","TCP","60","47512  >  23 [ACK] Seq=43 Ack=175 Win=33580 Len=0"
"412","2000-03-07 12:50:38,168162","172.16.112.50","202.77.162.213","TELNET","1192","Telnet Data ..."
"413","2000-03-07 12:50:38,192193","202.77.162.213","172.16.112.50","TCP","60","47512  >  23 [ACK] Seq=43 Ack=1313 Win=33580 Len=0"
"414","2000-03-07 12:50:38,201780","172.16.112.50","202.77.162.213","TELNET","62","Telnet Data ..."
"415","2000-03-07 12:50:38,205711","202.77.162.213","172.16.112.50","TELNET","75","Telnet Data ..."
"416","2000-03-07 12:50:38,206102","172.16.112.50","202.77.162.213","TELNET","75","Telnet Data ..."
"417","2000-03-07 12:50:38,222171","202.77.162.213","172.16.112.50","TCP","60","47512  >  23 [ACK] Seq=64 Ack=1342 Win=33580 Len=0"
"418","2000-03-07 12:50:38,224399","172.16.112.50","202.77.162.213","TELNET","62","Telnet Data ..."
"419","2000-03-07 12:50:38,228851","202.77.162.213","172.16.112.50","TELNET","72","Telnet Data ..."
"420","2000-03-07 12:50:38,229211","172.16.112.50","202.77.162.213","TELNET","72","Telnet Data ..."
"421","2000-03-07 12:50:38,242190","202.77.162.213","172.16.112.50","TCP","60","47512  >  23 [ACK] Seq=82 Ack=1368 Win=33580 Len=0"
"422","2000-03-07 12:50:38,242358","172.16.112.50","202.77.162.213","TELNET","62","Telnet Data ..."
"423","2000-03-07 12:50:38,246531","202.77.162.213","172.16.112.50","TELNET","135","Telnet Data ..."
"424","2000-03-07 12:50:38,247150","172.16.112.50","202.77.162.213","TELNET","135","Telnet Data ..."
"425","2000-03-07 12:50:38,262167","202.77.162.213","172.16.112.50","TCP","60","47512  >  23 [ACK] Seq=163 Ack=1457 Win=33580 Len=0"
"426","2000-03-07 12:50:38,278844","172.16.112.50","202.77.162.213","TCP","60","1023  >  514 [SYN] Seq=0 Win=8760 Len=0 MSS=1460"
"427","2000-03-07 12:50:38,279011","202.77.162.213","172.16.112.50","TCP","60","514  >  1023 [SYN, ACK] Seq=0 Ack=1 Win=33580 Len=0 MSS=1460"
"428","2000-03-07 12:50:38,279254","172.16.112.50","202.77.162.213","TCP","60","1023  >  514 [ACK] Seq=1 Ack=1 Win=8760 Len=0"
"429","2000-03-07 12:50:38,279445","172.16.112.50","202.77.162.213","RSH","60","Session Establishment"
"430","2000-03-07 12:50:38,343812","202.77.162.213","172.16.112.50","TCP","60","514  >  1023 [ACK] Seq=1 Ack=2 Win=33580 Len=0"
"431","2000-03-07 12:50:38,344016","172.16.112.50","202.77.162.213","RSH","139","Session Establishment"
"432","2000-03-07 12:50:38,423937","202.77.162.213","172.16.112.50","RSH","60","Server username:root Server -> Client Data"
"433","2000-03-07 12:50:38,455866","202.77.162.213","172.16.112.50","RSH","105","Server username:root Server -> Client Data"
"434","2000-03-07 12:50:38,456026","172.16.112.50","202.77.162.213","TCP","60","1023  >  514 [ACK] Seq=87 Ack=54 Win=8760 Len=0"
"435","2000-03-07 12:50:38,456356","172.16.112.50","202.77.162.213","TCP","60","1023  >  514 [FIN, ACK] Seq=87 Ack=54 Win=8760 Len=0"
"436","2000-03-07 12:50:38,456482","202.77.162.213","172.16.112.50","TCP","60","514  >  1023 [ACK] Seq=54 Ack=88 Win=33580 Len=0"
"437","2000-03-07 12:50:38,458349","172.16.112.50","202.77.162.213","TCP","60","[TCP Port numbers reused] 1023  >  514 [SYN] Seq=0 Win=8760 Len=0 MSS=1460"
"438","2000-03-07 12:50:38,458499","202.77.162.213","172.16.112.50","TCP","60","514  >  1023 [SYN, ACK] Seq=0 Ack=1 Win=33580 Len=0 MSS=1460"
"439","2000-03-07 12:50:38,458673","172.16.112.50","202.77.162.213","TCP","60","1023  >  514 [ACK] Seq=1 Ack=1 Win=8760 Len=0"
"440","2000-03-07 12:50:38,458825","172.16.112.50","202.77.162.213","RSH","60","Session Establishment"
"441","2000-03-07 12:50:38,543762","202.77.162.213","172.16.112.50","TCP","60","514  >  1023 [ACK] Seq=1 Ack=2 Win=33580 Len=0"
"442","2000-03-07 12:50:38,543963","172.16.112.50","202.77.162.213","RSH","125","Session Establishment"
"443","2000-03-07 12:50:38,624236","202.77.162.213","172.16.112.50","RSH","60","Server username:root Server -> Client Data"
"444","2000-03-07 12:50:38,624636","172.16.112.50","202.77.162.213","RSH","60","Server username:root Client -> Server data"
"445","2000-03-07 12:50:38,683301","202.77.162.213","172.16.112.50","RSH","77","Server username:root Server -> Client Data"
"446","2000-03-07 12:50:38,684331","172.16.112.50","202.77.162.213","RSH","60","Server username:root Client -> Server data"
"447","2000-03-07 12:50:38,691403","202.77.162.213","172.16.112.50","RSH","1514","Server username:root Server -> Client Data"
"448","2000-03-07 12:50:38,692674","202.77.162.213","172.16.112.50","RSH","1514","Server username:root Server -> Client Data"
"449","2000-03-07 12:50:38,693897","202.77.162.213","172.16.112.50","RSH","1514","Server username:root Server -> Client Data"
"450","2000-03-07 12:50:38,693974","172.16.112.50","202.77.162.213","TCP","60","1023  >  514 [ACK] Seq=75 Ack=1485 Win=24820 Len=0"
"451","2000-03-07 12:50:38,694100","172.16.112.50","202.77.162.213","TCP","60","1023  >  514 [ACK] Seq=75 Ack=4405 Win=24820 Len=0"
"452","2000-03-07 12:50:38,695334","202.77.162.213","172.16.112.50","RSH","1514","Server username:root Server -> Client Data"
"453","2000-03-07 12:50:38,700321","202.77.162.213","172.16.112.50","RSH","1514","Server username:root Server -> Client Data"
"454","2000-03-07 12:50:38,701609","202.77.162.213","172.16.112.50","RSH","1514","Server username:root Server -> Client Data"
"455","2000-03-07 12:50:38,702854","202.77.162.213","172.16.112.50","RSH","1514","Server username:root Server -> Client Data"
"456","2000-03-07 12:50:38,702921","172.16.112.50","202.77.162.213","TCP","60","1023  >  514 [ACK] Seq=75 Ack=8785 Win=24820 Len=0"
"457","2000-03-07 12:50:38,704157","202.77.162.213","172.16.112.50","RSH","1514","Server username:root Server -> Client Data"
"458","2000-03-07 12:50:38,705389","202.77.162.213","172.16.112.50","RSH","1514","Server username:root Server -> Client Data"
"459","2000-03-07 12:50:38,706833","202.77.162.213","172.16.112.50","RSH","1514","Server username:root Server -> Client Data"
"460","2000-03-07 12:50:38,707021","172.16.112.50","202.77.162.213","TCP","60","1023  >  514 [ACK] Seq=75 Ack=14625 Win=24820 Len=0"
"461","2000-03-07 12:50:38,709702","202.77.162.213","172.16.112.50","RSH","1514","Server username:root Server -> Client Data"
"462","2000-03-07 12:50:38,711075","202.77.162.213","172.16.112.50","RSH","1514","Server username:root Server -> Client Data"
"463","2000-03-07 12:50:38,712295","202.77.162.213","172.16.112.50","RSH","1514","Server username:root Server -> Client Data"
"464","2000-03-07 12:50:38,713601","202.77.162.213","172.16.112.50","RSH","1514","Server username:root Server -> Client Data"
"465","2000-03-07 12:50:38,714831","202.77.162.213","172.16.112.50","RSH","1514","Server username:root Server -> Client Data"
"466","2000-03-07 12:50:38,715019","172.16.112.50","202.77.162.213","TCP","60","1023  >  514 [ACK] Seq=75 Ack=21925 Win=24820 Len=0"
"467","2000-03-07 12:50:38,716303","202.77.162.213","172.16.112.50","RSH","1514","Server username:root Server -> Client Data"
"468","2000-03-07 12:50:38,718220","202.77.162.213","172.16.112.50","RSH","1514","Server username:root Server -> Client Data"
"469","2000-03-07 12:50:38,719478","202.77.162.213","172.16.112.50","RSH","1514","Server username:root Server -> Client Data"
"470","2000-03-07 12:50:38,720710","202.77.162.213","172.16.112.50","RSH","1514","Server username:root Server -> Client Data"
"471","2000-03-07 12:50:38,722078","202.77.162.213","172.16.112.50","RSH","1514","Server username:root Server -> Client Data"
"472","2000-03-07 12:50:38,723488","202.77.162.213","172.16.112.50","RSH","1514","Server username:root Server -> Client Data"
"473","2000-03-07 12:50:38,724789","202.77.162.213","172.16.112.50","RSH","1514","Server username:root Server -> Client Data"
"474","2000-03-07 12:50:38,726016","202.77.162.213","172.16.112.50","RSH","1514","Server username:root Server -> Client Data"
"475","2000-03-07 12:50:38,726098","172.16.112.50","202.77.162.213","TCP","60","1023  >  514 [ACK] Seq=75 Ack=30685 Win=24820 Len=0"
"476","2000-03-07 12:50:38,727334","202.77.162.213","172.16.112.50","RSH","1514","Server username:root Server -> Client Data"
"477","2000-03-07 12:50:38,728564","202.77.162.213","172.16.112.50","RSH","1514","Server username:root Server -> Client Data"
"478","2000-03-07 12:50:38,733151","202.77.162.213","172.16.112.50","RSH","1514","Server username:root Server -> Client Data"
"479","2000-03-07 12:50:38,734442","202.77.162.213","172.16.112.50","RSH","1514","Server username:root Server -> Client Data"
"480","2000-03-07 12:50:38,735784","202.77.162.213","172.16.112.50","RSH","1514","Server username:root Server -> Client Data"
"481","2000-03-07 12:50:38,737020","202.77.162.213","172.16.112.50","RSH","1514","Server username:root Server -> Client Data"
"482","2000-03-07 12:50:38,737097","172.16.112.50","202.77.162.213","TCP","60","1023  >  514 [ACK] Seq=75 Ack=40905 Win=24820 Len=0"
"483","2000-03-07 12:50:38,738366","202.77.162.213","172.16.112.50","RSH","1514","Server username:root Server -> Client Data"
"484","2000-03-07 12:50:38,782704","172.16.112.50","202.77.162.213","TCP","60","1023  >  514 [ACK] Seq=75 Ack=43825 Win=24820 Len=0"
"485","2000-03-07 12:50:38,783137","202.77.162.213","172.16.112.50","RSH","431","Server username:root Server -> Client Data"
"486","2000-03-07 12:50:38,783676","172.16.112.50","202.77.162.213","RSH","60","Server username:root Client -> Server data"
"487","2000-03-07 12:50:38,785835","202.77.162.213","172.16.112.50","TCP","60","514  >  1023 [FIN, ACK] Seq=44202 Ack=76 Win=33580 Len=0"
"488","2000-03-07 12:50:38,785979","172.16.112.50","202.77.162.213","TCP","60","1023  >  514 [ACK] Seq=76 Ack=44203 Win=24820 Len=0"
"489","2000-03-07 12:50:38,786329","172.16.112.50","202.77.162.213","TCP","60","1023  >  514 [FIN, ACK] Seq=76 Ack=44203 Win=24820 Len=0"
"490","2000-03-07 12:50:38,786451","202.77.162.213","172.16.112.50","TCP","60","514  >  1023 [ACK] Seq=44203 Ack=77 Win=33580 Len=0"
"491","2000-03-07 12:50:38,789077","172.16.112.50","202.77.162.213","TELNET","62","Telnet Data ..."
"492","2000-03-07 12:50:38,794174","202.77.162.213","172.16.112.50","TELNET","76","Telnet Data ..."
"493","2000-03-07 12:50:38,794549","172.16.112.50","202.77.162.213","TELNET","76","Telnet Data ..."
"494","2000-03-07 12:50:38,812258","202.77.162.213","172.16.112.50","TCP","60","47512  >  23 [ACK] Seq=185 Ack=1487 Win=33580 Len=0"
"495","2000-03-07 12:50:38,812810","172.16.112.50","202.77.162.213","TELNET","62","Telnet Data ..."
"496","2000-03-07 12:50:38,816715","202.77.162.213","172.16.112.50","TELNET","81","Telnet Data ..."
"497","2000-03-07 12:50:38,817090","172.16.112.50","202.77.162.213","TELNET","81","Telnet Data ..."
"498","2000-03-07 12:50:38,821028","202.77.162.213","172.16.112.50","TELNET","60","Telnet Data ..."
"499","2000-03-07 12:50:38,821224","172.16.112.50","202.77.162.213","TELNET","62","Telnet Data ..."
"500","2000-03-07 12:50:38,842269","202.77.162.213","172.16.112.50","TCP","60","47512  >  23 [ACK] Seq=218 Ack=1530 Win=33580 Len=0"
"501","2000-03-07 12:50:38,842473","172.16.112.50","202.77.162.213","TELNET","60","Telnet Data ..."
"502","2000-03-07 12:50:38,845085","172.16.112.50","202.77.162.213","TCP","60","23  >  47512 [FIN, ACK] Seq=1536 Ack=218 Win=8760 Len=0"
"503","2000-03-07 12:50:38,845218","202.77.162.213","172.16.112.50","TCP","60","47512  >  23 [ACK] Seq=218 Ack=1537 Win=33574 Len=0"
"504","2000-03-07 12:50:38,845828","202.77.162.213","172.16.112.50","TCP","60","47512  >  23 [FIN, ACK] Seq=218 Ack=1537 Win=33574 Len=0"
"505","2000-03-07 12:50:38,845992","172.16.112.50","202.77.162.213","TCP","60","23  >  47512 [ACK] Seq=1537 Ack=219 Win=8760 Len=0"
"506","2000-03-07 12:50:53,861651","202.77.162.213","172.16.112.50","TCP","74","1023  >  514 [SYN] Seq=0 Win=32768 Len=0 MSS=1460 WS=1 TSval=186692 TSecr=0"
"507","2000-03-07 12:50:53,861930","172.16.112.50","202.77.162.213","TCP","60","514  >  1023 [SYN, ACK] Seq=0 Ack=1 Win=8760 Len=0 MSS=1460"
"508","2000-03-07 12:50:53,862082","202.77.162.213","172.16.112.50","TCP","60","1023  >  514 [ACK] Seq=1 Ack=1 Win=33580 Len=0"
"509","2000-03-07 12:50:53,862511","202.77.162.213","172.16.112.50","RSH","60","Session Establishment"
"510","2000-03-07 12:50:53,904762","172.16.112.50","202.77.162.213","TCP","60","514  >  1023 [ACK] Seq=1 Ack=6 Win=8760 Len=0"
"511","2000-03-07 12:50:53,921429","172.16.112.50","202.77.162.213","TCP","60","1023  >  1022 [SYN] Seq=0 Win=8760 Len=0 MSS=1460"
"512","2000-03-07 12:50:53,921617","202.77.162.213","172.16.112.50","TCP","60","1022  >  1023 [SYN, ACK] Seq=0 Ack=1 Win=33580 Len=0 MSS=1460"
"513","2000-03-07 12:50:53,921812","172.16.112.50","202.77.162.213","TCP","60","1023  >  1022 [ACK] Seq=1 Ack=1 Win=8760 Len=0"
"514","2000-03-07 12:50:53,944574","202.77.162.213","172.16.112.50","RSH","106","Session Establishment"
"515","2000-03-07 12:50:53,970190","172.16.112.50","202.77.162.213","RSH","60","Server username:hacker2 Server -> Client Data"
"516","2000-03-07 12:50:53,972667","202.77.162.213","172.16.112.50","TCP","60","1023  >  514 [FIN, ACK] Seq=58 Ack=2 Win=33580 Len=0"
"517","2000-03-07 12:50:53,972846","172.16.112.50","202.77.162.213","TCP","60","514  >  1023 [ACK] Seq=2 Ack=59 Win=8760 Len=0"
"518","2000-03-07 12:50:54,047965","172.16.112.50","255.255.255.255","UDP","60","34459  >  9325 Len=9"
"519","2000-03-07 12:50:54,048885","172.16.112.50","202.77.162.213","RSH","112","Server username:hacker2 Server -> Client Data"
"520","2000-03-07 12:50:54,049012","202.77.162.213","172.16.112.50","TCP","60","1023  >  514 [RST] Seq=59 Win=0 Len=0"
