"No.","Time","Source","Destination","Protocol","Length","Info"
"1","2014-08-08 13:20:30,377422","Cisco_45:7e:30","PVST+","STP","64","RST. Root = 32768/501/70:ca:9b:45:7e:00  Cost = 0  Port = 0x8030"
"2","2014-08-08 13:20:30,482835","10.5.1.107","50.19.128.88","TLSv1.2","167","Application Data"
"3","2014-08-08 13:20:30,605786","10.5.1.103","50.19.128.88","TLSv1.2","167","Application Data"
"4","2014-08-08 13:20:30,623980","50.19.128.88","10.5.1.107","TLSv1.2","167","Application Data"
"5","2014-08-08 13:20:30,624306","10.5.1.107","50.19.128.88","TCP","66","33110  >  443 [ACK] Seq=102 Ack=102 Win=331 Len=0 TSval=767038 TSecr=1889738967"
"6","2014-08-08 13:20:30,634814","50.19.128.88","10.5.1.107","TCP","78","[TCP Dup ACK 4#1] 443  >  33110 [ACK] Seq=102 Ack=102 Win=1909 Len=0 TSval=1889738969 TSecr=767003 SLE=1 SRE=102"
"7","2014-08-08 13:20:30,698435","50.19.128.88","10.5.1.103","TLSv1.2","167","Application Data"
"8","2014-08-08 13:20:30,699003","10.5.1.103","50.19.128.88","TCP","66","55792  >  443 [ACK] Seq=102 Ack=102 Win=8185 Len=0 TSval=1003750395 TSecr=1889738999"
"9","2014-08-08 13:20:30,821549","10.5.1.2","23.203.220.244","TLSv1.2","1175","Application Data"
"10","2014-08-08 13:20:30,844798","23.203.220.244","10.5.1.2","TLSv1.2","391","Application Data"
"11","2014-08-08 13:20:30,845313","10.5.1.2","23.203.220.244","TCP","66","47195  >  443 [ACK] Seq=1110 Ack=326 Win=331 Len=0 TSval=1615450 TSecr=3038517168"
"12","2014-08-08 13:20:30,881741","10.5.1.108","50.19.128.88","TLSv1.2","167","Application Data"
"13","2014-08-08 13:20:30,976685","50.19.128.88","10.5.1.108","TLSv1.2","167","Application Data"
"14","2014-08-08 13:20:30,977135","10.5.1.108","50.19.128.88","TCP","66","49312  >  443 [ACK] Seq=102 Ack=102 Win=8185 Len=0 TSval=471133597 TSecr=1889739069"
"15","2014-08-08 13:20:31,365708","10.5.18.2","10.5.1.2","TCP","66","50861  >  4444 [SYN] Seq=0 Win=8192 Len=0 MSS=1460 WS=256 SACK_PERM"
"16","2014-08-08 13:20:31,366266","10.5.1.2","10.5.18.2","TCP","66","4444  >  50861 [SYN, ACK] Seq=0 Ack=1 Win=14600 Len=0 MSS=1460 SACK_PERM WS=128"
"17","2014-08-08 13:20:31,367004","10.5.18.2","10.5.1.2","TCP","60","50861  >  4444 [ACK] Seq=1 Ack=1 Win=65536 Len=0"
"18","2014-08-08 13:20:31,367204","10.5.18.2","10.5.1.2","HTTP","98","GET /../../../../home/wdub/flag HTTP/1.0 "
"19","2014-08-08 13:20:31,367703","10.5.1.2","10.5.18.2","TCP","60","4444  >  50861 [ACK] Seq=1 Ack=45 Win=14720 Len=0"
"20","2014-08-08 13:20:31,370347","10.5.1.2","10.5.18.2","HTTP","290","HTTP/1.1 200 OK  (unk/unk)Continuation"
"21","2014-08-08 13:20:31,371183","10.5.18.2","10.5.1.2","TCP","60","50861  >  4444 [FIN, ACK] Seq=45 Ack=237 Win=65280 Len=0"
"22","2014-08-08 13:20:31,411229","10.5.1.2","10.5.18.2","TCP","60","4444  >  50861 [ACK] Seq=237 Ack=46 Win=14720 Len=0"
"23","2014-08-08 13:20:31,776353","fe80::426c:8fff:fe37:7edb","ff02::fb","MDNS","102","Standard query 0x0000 PTR _googlecast._tcp.local, ""QM"" question"
"24","2014-08-08 13:20:32,046793","10.5.1.2","50.19.128.88","TLSv1.2","199","Application Data"
"25","2014-08-08 13:20:32,080953","10.5.1.110","50.19.128.88","TLSv1.2","167","Application Data"
"26","2014-08-08 13:20:32,138867","50.19.128.88","10.5.1.2","TLSv1.2","199","Application Data"
"27","2014-08-08 13:20:32,139293","10.5.1.2","50.19.128.88","TCP","66","59338  >  443 [ACK] Seq=134 Ack=134 Win=331 Len=0 TSval=1615709 TSecr=1889739359"
"28","2014-08-08 13:20:32,174049","50.19.128.88","10.5.1.110","TLSv1.2","167","Application Data"
"29","2014-08-08 13:20:32,174235","10.5.1.110","50.19.128.88","TCP","66","42228  >  443 [ACK] Seq=102 Ack=102 Win=228 Len=0 TSval=995037 TSecr=1889739369"
"30","2014-08-08 13:20:32,400719","Cisco_45:7e:30","PVST+","STP","64","RST. Root = 32768/501/70:ca:9b:45:7e:00  Cost = 0  Port = 0x8030"
"31","2014-08-08 13:20:32,897860","10.5.1.2","23.203.220.244","TLSv1.2","1159","Application Data"
"32","2014-08-08 13:20:32,953948","23.203.220.244","10.5.1.2","TLSv1.2","391","Application Data"
"33","2014-08-08 13:20:32,954498","10.5.1.2","23.203.220.244","TCP","66","47195  >  443 [ACK] Seq=2203 Ack=651 Win=331 Len=0 TSval=1615872 TSecr=3038519274"
"34","2014-08-08 13:20:33,172632","10.5.1.107","50.19.128.88","TLSv1.2","167","Application Data"
"35","2014-08-08 13:20:33,266159","50.19.128.88","10.5.1.107","TCP","66","443  >  33110 [ACK] Seq=102 Ack=203 Win=1859 Len=0 TSval=1889739641 TSecr=767675"
"36","2014-08-08 13:20:33,266174","50.19.128.88","10.5.1.107","TLSv1.2","167","Application Data"
"37","2014-08-08 13:20:33,266462","10.5.1.107","50.19.128.88","TCP","66","33110  >  443 [ACK] Seq=203 Ack=203 Win=331 Len=0 TSval=767698 TSecr=1889739641"
"38","2014-08-08 13:20:33,606592","10.5.1.103","50.19.128.88","TLSv1.2","167","Application Data"
"39","2014-08-08 13:20:33,698023","50.19.128.88","10.5.1.103","TLSv1.2","167","Application Data"
"40","2014-08-08 13:20:33,698622","10.5.1.103","50.19.128.88","TCP","66","55792  >  443 [ACK] Seq=203 Ack=203 Win=8185 Len=0 TSval=1003753387 TSecr=1889739749"
"41","2014-08-08 13:20:33,883390","10.5.1.108","50.19.128.88","TLSv1.2","167","Application Data"
"42","2014-08-08 13:20:33,978682","50.19.128.88","10.5.1.108","TLSv1.2","167","Application Data"
"43","2014-08-08 13:20:33,978918","10.5.1.108","50.19.128.88","TCP","66","49312  >  443 [ACK] Seq=203 Ack=203 Win=8185 Len=0 TSval=471136580 TSecr=1889739819"
"44","2014-08-08 13:20:34,019518","10.5.1.103","74.125.224.163","TLSv1.2","358","Application Data"
"45","2014-08-08 13:20:34,019542","10.5.1.103","74.125.224.163","TLSv1.2","107","Application Data"
"46","2014-08-08 13:20:34,020202","10.5.1.103","74.125.224.163","TCP","1484","55884  >  443 [ACK] Seq=334 Ack=1 Win=8192 Len=1418 TSval=1003753707 TSecr=1964285793 [TCP segment of a reassembled PDU]"
"47","2014-08-08 13:20:34,020364","10.5.1.103","74.125.224.163","TCP","1484","55884  >  443 [ACK] Seq=1752 Ack=1 Win=8192 Len=1418 TSval=1003753707 TSecr=1964285793 [TCP segment of a reassembled PDU]"
"48","2014-08-08 13:20:34,020370","10.5.1.103","74.125.224.163","TLSv1.2","119","Application Data"
"49","2014-08-08 13:20:34,030116","74.125.224.163","10.5.1.103","TCP","66","443  >  55884 [ACK] Seq=1 Ack=293 Win=670 Len=0 TSval=1964306370 TSecr=1003753707"
"50","2014-08-08 13:20:34,030130","74.125.224.163","10.5.1.103","TCP","66","443  >  55884 [ACK] Seq=1 Ack=334 Win=670 Len=0 TSval=1964306370 TSecr=1003753707"
"51","2014-08-08 13:20:34,030186","74.125.224.163","10.5.1.103","TLSv1.2","107","Application Data"
"52","2014-08-08 13:20:34,031251","10.5.1.103","74.125.224.163","TCP","1484","55884  >  443 [ACK] Seq=3223 Ack=1 Win=8192 Len=1418 TSval=1003753718 TSecr=1964306370 [TCP segment of a reassembled PDU]"
"53","2014-08-08 13:20:34,031268","10.5.1.103","74.125.224.163","TLSv1.2","72","Application Data"
"54","2014-08-08 13:20:34,031272","10.5.1.103","74.125.224.163","TCP","66","55884  >  443 [ACK] Seq=4647 Ack=42 Win=8189 Len=0 TSval=1003753718 TSecr=1964306370"
"55","2014-08-08 13:20:34,031842","74.125.224.163","10.5.1.103","TCP","66","443  >  55884 [ACK] Seq=42 Ack=3223 Win=642 Len=0 TSval=1964306371 TSecr=1003753707"
"56","2014-08-08 13:20:34,041991","74.125.224.163","10.5.1.103","TCP","66","443  >  55884 [ACK] Seq=42 Ack=4647 Win=642 Len=0 TSval=1964306382 TSecr=1003753718"
"57","2014-08-08 13:20:34,072840","74.125.224.163","10.5.1.103","TLSv1.2","135","Application Data"
"58","2014-08-08 13:20:34,072918","74.125.224.163","10.5.1.103","TLSv1.2","1466","Application Data"
"59","2014-08-08 13:20:34,072965","74.125.224.163","10.5.1.103","TLSv1.2","1466","Application Data"
"60","2014-08-08 13:20:34,073064","74.125.224.163","10.5.1.103","TLSv1.2","1466","Application Data"
"61","2014-08-08 13:20:34,073072","74.125.224.163","10.5.1.103","TLSv1.2","107","Application Data"
"62","2014-08-08 13:20:34,073076","74.125.224.163","10.5.1.103","TLSv1.2","107","Application Data"
"63","2014-08-08 13:20:34,073415","10.5.1.103","74.125.224.163","TCP","66","55884  >  443 [ACK] Seq=4647 Ack=111 Win=8187 Len=0 TSval=1003753759 TSecr=1964306412"
"64","2014-08-08 13:20:34,073475","10.5.1.103","74.125.224.163","TCP","66","55884  >  443 [ACK] Seq=4647 Ack=1511 Win=8104 Len=0 TSval=1003753759 TSecr=1964306412"
"65","2014-08-08 13:20:34,073616","10.5.1.103","74.125.224.163","TCP","66","55884  >  443 [ACK] Seq=4647 Ack=2911 Win=8104 Len=0 TSval=1003753759 TSecr=1964306412"
"66","2014-08-08 13:20:34,073669","10.5.1.103","74.125.224.163","TCP","66","55884  >  443 [ACK] Seq=4647 Ack=4311 Win=8017 Len=0 TSval=1003753759 TSecr=1964306412"
"67","2014-08-08 13:20:34,073765","10.5.1.103","74.125.224.163","TCP","66","55884  >  443 [ACK] Seq=4647 Ack=4352 Win=8014 Len=0 TSval=1003753759 TSecr=1964306412"
"68","2014-08-08 13:20:34,073783","10.5.1.103","74.125.224.163","TCP","66","55884  >  443 [ACK] Seq=4647 Ack=4393 Win=8011 Len=0 TSval=1003753759 TSecr=1964306412"
"69","2014-08-08 13:20:34,074164","10.5.1.103","74.125.224.163","TCP","66","[TCP Window Update] 55884  >  443 [ACK] Seq=4647 Ack=4393 Win=8192 Len=0 TSval=1003753759 TSecr=1964306412"
"70","2014-08-08 13:20:34,074911","10.5.1.103","74.125.224.163","TLSv1.2","107","Application Data"
"71","2014-08-08 13:20:34,077464","10.5.1.103","74.125.224.163","TLSv1.2","358","Application Data"
"72","2014-08-08 13:20:34,078013","10.5.1.103","74.125.224.163","TCP","1484","55884  >  443 [ACK] Seq=4980 Ack=4393 Win=8192 Len=1418 TSval=1003753762 TSecr=1964306412 [TCP segment of a reassembled PDU]"
"73","2014-08-08 13:20:34,078020","10.5.1.103","74.125.224.163","TLSv1.2","554","Application Data"
"74","2014-08-08 13:20:34,088104","74.125.224.163","10.5.1.103","TCP","66","443  >  55884 [ACK] Seq=4393 Ack=4980 Win=670 Len=0 TSval=1964306428 TSecr=1003753760"
"75","2014-08-08 13:20:34,088639","74.125.224.163","10.5.1.103","TCP","66","443  >  55884 [ACK] Seq=4393 Ack=6886 Win=642 Len=0 TSval=1964306429 TSecr=1003753762"
"76","2014-08-08 13:20:34,144000","74.125.224.163","10.5.1.103","TLSv1.2","123","Application Data"
"77","2014-08-08 13:20:34,144249","74.125.224.163","10.5.1.103","TLSv1.2","434","Application Data"
"78","2014-08-08 13:20:34,144259","74.125.224.163","10.5.1.103","TLSv1.2","107","Application Data"
"79","2014-08-08 13:20:34,144699","10.5.1.103","74.125.224.163","TCP","66","55884  >  443 [ACK] Seq=6886 Ack=4450 Win=8188 Len=0 TSval=1003753828 TSecr=1964306484"
"80","2014-08-08 13:20:34,144705","10.5.1.103","74.125.224.163","TCP","66","55884  >  443 [ACK] Seq=6886 Ack=4818 Win=8169 Len=0 TSval=1003753828 TSecr=1964306484"
"81","2014-08-08 13:20:34,144801","10.5.1.103","74.125.224.163","TCP","66","55884  >  443 [ACK] Seq=6886 Ack=4859 Win=8166 Len=0 TSval=1003753828 TSecr=1964306484"
"82","2014-08-08 13:20:34,145796","10.5.1.103","74.125.224.163","TLSv1.2","107","Application Data"
"83","2014-08-08 13:20:34,197959","74.125.224.163","10.5.1.103","TCP","66","443  >  55884 [ACK] Seq=4859 Ack=6927 Win=670 Len=0 TSval=1964306537 TSecr=1003753829"
"84","2014-08-08 13:20:34,412154","Cisco_45:7e:30","PVST+","STP","64","RST. Root = 32768/501/70:ca:9b:45:7e:00  Cost = 0  Port = 0x8030"
"85","2014-08-08 13:20:35,047896","10.5.1.2","50.19.128.88","TLSv1.2","199","Application Data"
"86","2014-08-08 13:20:35,081194","10.5.1.110","50.19.128.88","TLSv1.2","167","Application Data"
"87","2014-08-08 13:20:35,142791","50.19.128.88","10.5.1.2","TLSv1.2","199","Application Data"
"88","2014-08-08 13:20:35,143240","10.5.1.2","50.19.128.88","TCP","66","59338  >  443 [ACK] Seq=267 Ack=267 Win=331 Len=0 TSval=1616310 TSecr=1889740110"
"89","2014-08-08 13:20:35,175987","50.19.128.88","10.5.1.110","TLSv1.2","167","Application Data"
"90","2014-08-08 13:20:35,176187","10.5.1.110","50.19.128.88","TCP","66","42228  >  443 [ACK] Seq=203 Ack=203 Win=228 Len=0 TSval=995788 TSecr=1889740119"
"91","2014-08-08 13:20:35,546134","fe80::f2de:f1ff:fe6c:7c3e","ff02::2","ICMPv6","62","Router Solicitation"
"92","2014-08-08 13:20:36,085303","10.5.1.2","23.5.251.27","TCP","66","36901  >  80 [FIN, ACK] Seq=1 Ack=1 Win=160 Len=0 TSval=1616498 TSecr=2080379534"
"93","2014-08-08 13:20:36,105583","23.5.251.27","10.5.1.2","TCP","66","80  >  36901 [FIN, ACK] Seq=1 Ack=2 Win=7776 Len=0 TSval=2080440443 TSecr=1616498"
"94","2014-08-08 13:20:36,106019","10.5.1.2","23.5.251.27","TCP","66","36901  >  80 [ACK] Seq=2 Ack=2 Win=160 Len=0 TSval=1616502 TSecr=2080440443"
"95","2014-08-08 13:20:36,172572","10.5.1.107","50.19.128.88","TLSv1.2","167","Application Data"
"96","2014-08-08 13:20:36,266110","50.19.128.88","10.5.1.107","TLSv1.2","167","Application Data"
"97","2014-08-08 13:20:36,266410","10.5.1.107","50.19.128.88","TCP","66","33110  >  443 [ACK] Seq=304 Ack=304 Win=331 Len=0 TSval=768448 TSecr=1889740391"
"98","2014-08-08 13:20:36,425370","Cisco_45:7e:30","PVST+","STP","64","RST. Root = 32768/501/70:ca:9b:45:7e:00  Cost = 0  Port = 0x8030"
"99","2014-08-08 13:20:36,605737","10.5.1.103","50.19.128.88","TLSv1.2","167","Application Data"
"100","2014-08-08 13:20:36,696869","50.19.128.88","10.5.1.103","TLSv1.2","167","Application Data"
"101","2014-08-08 13:20:36,697478","10.5.1.103","50.19.128.88","TCP","66","55792  >  443 [ACK] Seq=304 Ack=304 Win=8185 Len=0 TSval=1003756375 TSecr=1889740499"
"102","2014-08-08 13:20:36,884619","10.5.1.108","50.19.128.88","TLSv1.2","167","Application Data"
"103","2014-08-08 13:20:36,978816","50.19.128.88","10.5.1.108","TLSv1.2","167","Application Data"
"104","2014-08-08 13:20:36,979217","10.5.1.108","50.19.128.88","TCP","66","49312  >  443 [ACK] Seq=304 Ack=304 Win=8185 Len=0 TSval=471139530 TSecr=1889740570"
"105","2014-08-08 13:20:37,049748","10.5.1.2","23.203.220.244","TLSv1.2","1175","Application Data"
"106","2014-08-08 13:20:37,076509","23.203.220.244","10.5.1.2","TLSv1.2","391","Application Data"
"107","2014-08-08 13:20:37,077012","10.5.1.2","23.203.220.244","TCP","66","47195  >  443 [ACK] Seq=3312 Ack=976 Win=331 Len=0 TSval=1616697 TSecr=3038523400"
"108","2014-08-08 13:20:38,049049","10.5.1.2","50.19.128.88","TLSv1.2","199","Application Data"
"109","2014-08-08 13:20:38,081464","10.5.1.110","50.19.128.88","TLSv1.2","167","Application Data"
"110","2014-08-08 13:20:38,141300","50.19.128.88","10.5.1.2","TLSv1.2","199","Application Data"
"111","2014-08-08 13:20:38,141751","10.5.1.2","50.19.128.88","TCP","66","59338  >  443 [ACK] Seq=400 Ack=400 Win=331 Len=0 TSval=1616910 TSecr=1889740860"
"112","2014-08-08 13:20:38,175744","50.19.128.88","10.5.1.110","TLSv1.2","167","Application Data"
"113","2014-08-08 13:20:38,175947","10.5.1.110","50.19.128.88","TCP","66","42228  >  443 [ACK] Seq=304 Ack=304 Win=228 Len=0 TSval=996538 TSecr=1889740869"
"114","2014-08-08 13:20:38,446865","Cisco_45:7e:30","PVST+","STP","64","RST. Root = 32768/501/70:ca:9b:45:7e:00  Cost = 0  Port = 0x8030"
"115","2014-08-08 13:20:39,025003","10.5.1.108","239.255.255.250","SSDP","204","M-SEARCH * HTTP/1.1 "
"116","2014-08-08 13:20:39,125184","10.5.1.2","23.203.220.244","TLSv1.2","1175","Application Data"
"117","2014-08-08 13:20:39,149894","23.203.220.244","10.5.1.2","TLSv1.2","391","Application Data"
"118","2014-08-08 13:20:39,150340","10.5.1.2","23.203.220.244","TCP","66","47195  >  443 [ACK] Seq=4421 Ack=1301 Win=331 Len=0 TSval=1617111 TSecr=3038525472"
"119","2014-08-08 13:20:39,172865","10.5.1.107","50.19.128.88","TLSv1.2","167","Application Data"
"120","2014-08-08 13:20:39,267100","50.19.128.88","10.5.1.107","TLSv1.2","167","Application Data"
"121","2014-08-08 13:20:39,267450","10.5.1.107","50.19.128.88","TCP","66","33110  >  443 [ACK] Seq=405 Ack=405 Win=331 Len=0 TSval=769199 TSecr=1889741141"
"122","2014-08-08 13:20:39,401134","10.5.6.2","10.5.1.2","ICMP","98","Echo (ping) request  id=0x0460, seq=1/256, ttl=63 (reply in 123)"
"123","2014-08-08 13:20:39,401486","10.5.1.2","10.5.6.2","ICMP","98","Echo (ping) reply    id=0x0460, seq=1/256, ttl=64 (request in 122)"
"124","2014-08-08 13:20:39,605852","10.5.1.103","50.19.128.88","TLSv1.2","167","Application Data"
"125","2014-08-08 13:20:39,702095","50.19.128.88","10.5.1.103","TLSv1.2","167","Application Data"
"126","2014-08-08 13:20:39,702696","10.5.1.103","50.19.128.88","TCP","66","55792  >  443 [ACK] Seq=405 Ack=405 Win=8185 Len=0 TSval=1003759373 TSecr=1889741249"
"127","2014-08-08 13:20:39,885957","10.5.1.108","50.19.128.88","TLSv1.2","167","Application Data"
"128","2014-08-08 13:20:39,980646","50.19.128.88","10.5.1.108","TLSv1.2","167","Application Data"
"129","2014-08-08 13:20:39,981048","10.5.1.108","50.19.128.88","TCP","66","49312  >  443 [ACK] Seq=405 Ack=405 Win=8185 Len=0 TSval=471142473 TSecr=1889741320"
"130","2014-08-08 13:20:40,009500","10.5.16.2","10.5.1.2","TCP","60","50225  >  4444 [ACK] Seq=1 Ack=1 Win=254 Len=1"
"131","2014-08-08 13:20:40,009851","10.5.1.2","10.5.16.2","TCP","66","4444  >  50225 [ACK] Seq=1 Ack=2 Win=160 Len=0 SLE=1 SRE=2"
"132","2014-08-08 13:20:40,025680","10.5.1.108","239.255.255.250","SSDP","204","M-SEARCH * HTTP/1.1 "
"133","2014-08-08 13:20:40,402210","10.5.6.2","10.5.1.2","ICMP","98","Echo (ping) request  id=0x0460, seq=2/512, ttl=63 (reply in 134)"
"134","2014-08-08 13:20:40,402609","10.5.1.2","10.5.6.2","ICMP","98","Echo (ping) reply    id=0x0460, seq=2/512, ttl=64 (request in 133)"
"135","2014-08-08 13:20:40,460118","Cisco_45:7e:30","PVST+","STP","64","RST. Root = 32768/501/70:ca:9b:45:7e:00  Cost = 0  Port = 0x8030"
"136","2014-08-08 13:20:41,026757","10.5.1.108","239.255.255.250","SSDP","204","M-SEARCH * HTTP/1.1 "
"137","2014-08-08 13:20:41,049410","10.5.1.2","50.19.128.88","TLSv1.2","199","Application Data"
"138","2014-08-08 13:20:41,081470","10.5.1.110","50.19.128.88","TLSv1.2","167","Application Data"
"139","2014-08-08 13:20:41,141711","50.19.128.88","10.5.1.2","TLSv1.2","199","Application Data"
"140","2014-08-08 13:20:41,142063","10.5.1.2","50.19.128.88","TCP","66","59338  >  443 [ACK] Seq=533 Ack=533 Win=331 Len=0 TSval=1617510 TSecr=1889741610"
"141","2014-08-08 13:20:41,174908","50.19.128.88","10.5.1.110","TLSv1.2","167","Application Data"
"142","2014-08-08 13:20:41,175108","10.5.1.110","50.19.128.88","TCP","66","42228  >  443 [ACK] Seq=405 Ack=405 Win=228 Len=0 TSval=997288 TSecr=1889741619"
"143","2014-08-08 13:20:41,201067","10.5.1.2","23.203.220.244","TLSv1.2","1175","Application Data"
"144","2014-08-08 13:20:41,246892","23.203.220.244","10.5.1.2","TLSv1.2","391","Application Data"
"145","2014-08-08 13:20:41,247340","10.5.1.2","23.203.220.244","TCP","66","47195  >  443 [ACK] Seq=5530 Ack=1626 Win=331 Len=0 TSval=1617531 TSecr=3038527570"
"146","2014-08-08 13:20:41,482318","10.5.1.103","74.125.224.175","HTTP","398","GET /generate_204 HTTP/1.1 "
"147","2014-08-08 13:20:41,493441","74.125.224.175","10.5.1.103","HTTP","206","HTTP/1.1 204 No Content "
"148","2014-08-08 13:20:41,493989","10.5.1.103","74.125.224.175","TCP","66","55938  >  80 [ACK] Seq=333 Ack=141 Win=8224 Len=0 TSval=1003761160 TSecr=1964313048"
"149","2014-08-08 13:20:41,553398","10.5.1.103","10.5.1.255","DB-LSP-DISC/JSON","196","Dropbox LAN sync Discovery Protocol, JavaScript Object Notation"
"150","2014-08-08 13:20:41,553543","10.5.1.103","255.255.255.255","DB-LSP-DISC/JSON","196","Dropbox LAN sync Discovery Protocol, JavaScript Object Notation"
"151","2014-08-08 13:20:41,667957","10.5.1.102","74.125.28.188","TCP","60","51932  >  5228 [ACK] Seq=1 Ack=1 Win=16274 Len=1"
"152","2014-08-08 13:20:41,707545","74.125.28.188","10.5.1.102","TCP","66","5228  >  51932 [ACK] Seq=1 Ack=2 Win=670 Len=0 SLE=1 SRE=2"
"153","2014-08-08 13:20:42,027079","10.5.1.108","239.255.255.250","SSDP","204","M-SEARCH * HTTP/1.1 "
"154","2014-08-08 13:20:42,171544","10.5.1.107","50.19.128.88","TLSv1.2","167","Application Data"
"155","2014-08-08 13:20:42,263992","50.19.128.88","10.5.1.107","TLSv1.2","167","Application Data"
"156","2014-08-08 13:20:42,264241","10.5.1.107","50.19.128.88","TCP","66","33110  >  443 [ACK] Seq=506 Ack=506 Win=331 Len=0 TSval=769948 TSecr=1889741891"
"157","2014-08-08 13:20:42,483436","Cisco_45:7e:30","PVST+","STP","64","RST. Root = 32768/501/70:ca:9b:45:7e:00  Cost = 0  Port = 0x8030"
"158","2014-08-08 13:20:42,558514","10.5.16.2","10.5.1.2","TCP","74","54566  >  80 [SYN] Seq=0 Win=14600 Len=0 MSS=1460 SACK_PERM TSval=1617800 TSecr=0 WS=128"
"159","2014-08-08 13:20:42,558819","10.5.1.2","10.5.16.2","TCP","60","80  >  54566 [RST, ACK] Seq=1 Ack=1 Win=0 Len=0"
"160","2014-08-08 13:20:42,605987","10.5.1.103","50.19.128.88","TLSv1.2","167","Application Data"
"161","2014-08-08 13:20:42,697443","50.19.128.88","10.5.1.103","TLSv1.2","167","Application Data"
"162","2014-08-08 13:20:42,698112","10.5.1.103","50.19.128.88","TCP","66","55792  >  443 [ACK] Seq=506 Ack=506 Win=8185 Len=0 TSval=1003762362 TSecr=1889741999"
"163","2014-08-08 13:20:42,886285","10.5.1.108","50.19.128.88","TLSv1.2","167","Application Data"
"164","2014-08-08 13:20:42,980430","50.19.128.88","10.5.1.108","TLSv1.2","167","Application Data"
"165","2014-08-08 13:20:42,980832","10.5.1.108","50.19.128.88","TCP","66","49312  >  443 [ACK] Seq=506 Ack=506 Win=8185 Len=0 TSval=471145433 TSecr=1889742070"
"166","2014-08-08 13:20:43,281693","10.5.1.2","23.203.220.244","TLSv1.2","1175","Application Data"
"167","2014-08-08 13:20:43,343991","23.203.220.244","10.5.1.2","TLSv1.2","391","Application Data"
"168","2014-08-08 13:20:43,344439","10.5.1.2","23.203.220.244","TCP","66","47195  >  443 [ACK] Seq=6639 Ack=1951 Win=331 Len=0 TSval=1617950 TSecr=3038529666"
"169","2014-08-08 13:20:43,561549","fe80::f2de:f1ff:fe6c:7c3e","ff02::fb","MDNS","102","Standard query 0x0000 PTR _googlecast._tcp.local, ""QM"" question"
"170","2014-08-08 13:20:43,577965","10.5.1.106","10.5.1.1","DNS","84","Standard query 0xc2e1 A www.google-analytics.com"
"171","2014-08-08 13:20:43,578316","10.5.1.1","10.5.1.106","DNS","440","Standard query response 0xc2e1 A www.google-analytics.com CNAME www-google-analytics.l.google.com A 74.125.224.160 A 74.125.224.165 A 74.125.224.166 A 74.125.224.163 A 74.125.224.174 A 74.125.224.161 A 74.125.224.168 A 74.125.224.169 A 74.125.224.164 A 74.125.224.162 A 74.125.224.167 NS ns2.google.com NS ns3.google.com NS ns4.google.com NS ns1.google.com A 216.239.32.10 A 216.239.34.10 A 216.239.36.10 A 216.239.38.10"
"172","2014-08-08 13:20:44,050516","10.5.1.2","50.19.128.88","TLSv1.2","199","Application Data"
"173","2014-08-08 13:20:44,081872","10.5.1.110","50.19.128.88","TLSv1.2","167","Application Data"
"174","2014-08-08 13:20:44,143097","50.19.128.88","10.5.1.2","TLSv1.2","199","Application Data"
"175","2014-08-08 13:20:44,143447","10.5.1.2","50.19.128.88","TCP","66","59338  >  443 [ACK] Seq=666 Ack=666 Win=331 Len=0 TSval=1618110 TSecr=1889742360"
"176","2014-08-08 13:20:44,176185","50.19.128.88","10.5.1.110","TLSv1.2","167","Application Data"
"177","2014-08-08 13:20:44,176445","10.5.1.110","50.19.128.88","TCP","66","42228  >  443 [ACK] Seq=506 Ack=506 Win=228 Len=0 TSval=998038 TSecr=1889742369"
"178","2014-08-08 13:20:44,494576","Cisco_45:7e:30","PVST+","STP","64","RST. Root = 32768/501/70:ca:9b:45:7e:00  Cost = 0  Port = 0x8030"
"179","2014-08-08 13:20:44,562135","fe80::f2de:f1ff:fe6c:7c3e","ff02::fb","MDNS","102","Standard query 0x0000 PTR _googlecast._tcp.local, ""QM"" question"
"180","2014-08-08 13:20:45,171938","10.5.1.107","50.19.128.88","TLSv1.2","167","Application Data"
"181","2014-08-08 13:20:45,264528","50.19.128.88","10.5.1.107","TLSv1.2","167","Application Data"
"182","2014-08-08 13:20:45,264829","10.5.1.107","50.19.128.88","TCP","66","33110  >  443 [ACK] Seq=607 Ack=607 Win=331 Len=0 TSval=770698 TSecr=1889742641"
"183","2014-08-08 13:20:45,355636","10.5.1.2","23.203.220.244","TLSv1.2","1175","Application Data"
"184","2014-08-08 13:20:45,380000","23.203.220.244","10.5.1.2","TLSv1.2","391","Application Data"
"185","2014-08-08 13:20:45,380449","10.5.1.2","23.203.220.244","TCP","66","47195  >  443 [ACK] Seq=7748 Ack=2276 Win=331 Len=0 TSval=1618357 TSecr=3038531703"
"186","2014-08-08 13:20:45,542937","fe80::f2de:f1ff:fe6c:7c3e","ff02::2","ICMPv6","62","Router Solicitation"
"187","2014-08-08 13:20:45,606293","10.5.1.103","50.19.128.88","TLSv1.2","167","Application Data"
"188","2014-08-08 13:20:45,697478","50.19.128.88","10.5.1.103","TLSv1.2","167","Application Data"
"189","2014-08-08 13:20:45,698129","10.5.1.103","50.19.128.88","TCP","66","55792  >  443 [ACK] Seq=607 Ack=607 Win=8185 Len=0 TSval=1003765357 TSecr=1889742749"
"190","2014-08-08 13:20:45,800208","192.241.188.153","10.5.1.102","SSH","234","Server: Encrypted packet (len=180)"
"191","2014-08-08 13:20:45,887668","10.5.1.108","50.19.128.88","TLSv1.2","167","Application Data"
"192","2014-08-08 13:20:45,982414","50.19.128.88","10.5.1.108","TLSv1.2","167","Application Data"
"193","2014-08-08 13:20:45,982814","10.5.1.108","50.19.128.88","TCP","66","49312  >  443 [ACK] Seq=607 Ack=607 Win=8185 Len=0 TSval=471148401 TSecr=1889742820"
"194","2014-08-08 13:20:45,998205","10.5.1.102","192.241.188.153","TCP","60","51397  >  22 [ACK] Seq=1 Ack=181 Win=16184 Len=0"
"195","2014-08-08 13:20:46,447262","HewlettP_4f:37:c4","Broadcom_72:00:3c","ARP","60","Who has 10.5.1.1? Tell 10.5.1.102"
"196","2014-08-08 13:20:46,447282","Broadcom_72:00:3c","HewlettP_4f:37:c4","ARP","60","10.5.1.1 is at 00:10:18:72:00:3c"
"197","2014-08-08 13:20:46,507700","Cisco_45:7e:30","PVST+","STP","64","RST. Root = 32768/501/70:ca:9b:45:7e:00  Cost = 0  Port = 0x8030"
"198","2014-08-08 13:20:46,563277","fe80::f2de:f1ff:fe6c:7c3e","ff02::fb","MDNS","102","Standard query 0x0000 PTR _googlecast._tcp.local, ""QM"" question"
"199","2014-08-08 13:20:47,050768","10.5.1.2","50.19.128.88","TLSv1.2","199","Application Data"
"200","2014-08-08 13:20:47,080942","10.5.1.110","50.19.128.88","TLSv1.2","167","Application Data"
"201","2014-08-08 13:20:47,146411","50.19.128.88","10.5.1.2","TLSv1.2","199","Application Data"
"202","2014-08-08 13:20:47,146813","10.5.1.2","50.19.128.88","TCP","66","59338  >  443 [ACK] Seq=799 Ack=799 Win=331 Len=0 TSval=1618711 TSecr=1889743110"
"203","2014-08-08 13:20:47,177111","50.19.128.88","10.5.1.110","TLSv1.2","167","Application Data"
"204","2014-08-08 13:20:47,177312","10.5.1.110","50.19.128.88","TCP","66","42228  >  443 [ACK] Seq=607 Ack=607 Win=228 Len=0 TSval=998788 TSecr=1889743119"
"205","2014-08-08 13:20:47,429518","10.5.1.2","23.203.220.244","TLSv1.2","1175","Application Data"
"206","2014-08-08 13:20:47,454411","23.203.220.244","10.5.1.2","TLSv1.2","391","Application Data"
"207","2014-08-08 13:20:47,454813","10.5.1.2","23.203.220.244","TCP","66","47195  >  443 [ACK] Seq=8857 Ack=2601 Win=331 Len=0 TSval=1618772 TSecr=3038533777"
"208","2014-08-08 13:20:48,171505","10.5.1.107","50.19.128.88","TLSv1.2","167","Application Data"
"209","2014-08-08 13:20:48,264298","50.19.128.88","10.5.1.107","TLSv1.2","167","Application Data"
"210","2014-08-08 13:20:48,264605","10.5.1.107","50.19.128.88","TCP","66","33110  >  443 [ACK] Seq=708 Ack=708 Win=331 Len=0 TSval=771448 TSecr=1889743391"
"211","2014-08-08 13:20:48,424407","10.5.1.108","10.5.1.255","DB-LSP-DISC/JSON","253","Dropbox LAN sync Discovery Protocol, JavaScript Object Notation"
"212","2014-08-08 13:20:48,425106","10.5.1.108","255.255.255.255","DB-LSP-DISC/JSON","253","Dropbox LAN sync Discovery Protocol, JavaScript Object Notation"
"213","2014-08-08 13:20:48,529469","Cisco_45:7e:30","PVST+","STP","64","RST. Root = 32768/501/70:ca:9b:45:7e:00  Cost = 0  Port = 0x8030"
"214","2014-08-08 13:20:48,581243","WistronI_6c:7c:3e","Broadcom_72:00:3c","ARP","60","Who has 10.5.1.1? Tell 10.5.1.106"
"215","2014-08-08 13:20:48,581254","Broadcom_72:00:3c","WistronI_6c:7c:3e","ARP","60","10.5.1.1 is at 00:10:18:72:00:3c"
"216","2014-08-08 13:20:48,605443","10.5.1.103","50.19.128.88","TLSv1.2","167","Application Data"
"217","2014-08-08 13:20:48,698346","50.19.128.88","10.5.1.103","TLSv1.2","167","Application Data"
"218","2014-08-08 13:20:48,698996","10.5.1.103","50.19.128.88","TCP","66","55792  >  443 [ACK] Seq=708 Ack=708 Win=8185 Len=0 TSval=1003768351 TSecr=1889743499"
"219","2014-08-08 13:20:48,889537","10.5.1.108","50.19.128.88","TLSv1.2","167","Application Data"
"220","2014-08-08 13:20:48,987794","50.19.128.88","10.5.1.108","TLSv1.2","167","Application Data"
"221","2014-08-08 13:20:48,988281","10.5.1.108","50.19.128.88","TCP","66","49312  >  443 [ACK] Seq=708 Ack=708 Win=8185 Len=0 TSval=471151328 TSecr=1889743571"
"222","2014-08-08 13:20:49,503439","10.5.1.2","23.203.220.244","TLSv1.2","1159","Application Data"
"223","2014-08-08 13:20:49,566440","23.203.220.244","10.5.1.2","TCP","66","443  >  47195 [ACK] Seq=2601 Ack=9950 Win=43654 Len=0 TSval=3038535890 TSecr=1619182"
"224","2014-08-08 13:20:49,580689","23.203.220.244","10.5.1.2","TLSv1.2","391","Application Data"
"225","2014-08-08 13:20:49,581204","10.5.1.2","23.203.220.244","TCP","66","47195  >  443 [ACK] Seq=9950 Ack=2926 Win=331 Len=0 TSval=1619197 TSecr=3038535903"
"226","2014-08-08 13:20:50,051896","10.5.1.2","50.19.128.88","TLSv1.2","199","Application Data"
"227","2014-08-08 13:20:50,081197","10.5.1.110","50.19.128.88","TLSv1.2","167","Application Data"
"228","2014-08-08 13:20:50,142929","50.19.128.88","10.5.1.2","TLSv1.2","199","Application Data"
"229","2014-08-08 13:20:50,143329","10.5.1.2","50.19.128.88","TCP","66","59338  >  443 [ACK] Seq=932 Ack=932 Win=331 Len=0 TSval=1619310 TSecr=1889743861"
"230","2014-08-08 13:20:50,175776","50.19.128.88","10.5.1.110","TLSv1.2","167","Application Data"
"231","2014-08-08 13:20:50,175976","10.5.1.110","50.19.128.88","TCP","66","42228  >  443 [ACK] Seq=708 Ack=708 Win=228 Len=0 TSval=999538 TSecr=1889743869"
"232","2014-08-08 13:20:50,542551","Cisco_45:7e:30","PVST+","STP","64","RST. Root = 32768/501/70:ca:9b:45:7e:00  Cost = 0  Port = 0x8030"
"233","2014-08-08 13:20:51,172074","10.5.1.107","50.19.128.88","TLSv1.2","167","Application Data"
"234","2014-08-08 13:20:51,265815","50.19.128.88","10.5.1.107","TLSv1.2","167","Application Data"
"235","2014-08-08 13:20:51,266114","10.5.1.107","50.19.128.88","TCP","66","33110  >  443 [ACK] Seq=809 Ack=809 Win=331 Len=0 TSval=772198 TSecr=1889744141"
"236","2014-08-08 13:20:51,605912","10.5.1.103","50.19.128.88","TLSv1.2","167","Application Data"
"237","2014-08-08 13:20:51,697373","50.19.128.88","10.5.1.103","TLSv1.2","167","Application Data"
"238","2014-08-08 13:20:51,698063","10.5.1.103","50.19.128.88","TCP","66","55792  >  443 [ACK] Seq=809 Ack=809 Win=8185 Len=0 TSval=1003771344 TSecr=1889744249"
"239","2014-08-08 13:20:51,852663","10.5.1.107","107.20.214.173","TCP","74","40889  >  443 [SYN] Seq=0 Win=14600 Len=0 MSS=1460 SACK_PERM TSval=772345 TSecr=0 WS=128"
"240","2014-08-08 13:20:51,891367","10.5.1.108","50.19.128.88","TLSv1.2","167","Application Data"
"241","2014-08-08 13:20:51,947062","107.20.214.173","10.5.1.107","TCP","74","443  >  40889 [SYN, ACK] Seq=0 Ack=1 Win=14480 Len=0 MSS=1460 SACK_PERM TSval=912761784 TSecr=772345 WS=256"
"242","2014-08-08 13:20:51,947309","10.5.1.107","107.20.214.173","TCP","66","40889  >  443 [ACK] Seq=1 Ack=1 Win=14720 Len=0 TSval=772369 TSecr=912761784"
"243","2014-08-08 13:20:51,947618","10.5.1.107","107.20.214.173","TLSv1.2","281","Client Hello"
"244","2014-08-08 13:20:51,986398","50.19.128.88","10.5.1.108","TLSv1.2","167","Application Data"
"245","2014-08-08 13:20:51,986796","10.5.1.108","50.19.128.88","TCP","66","49312  >  443 [ACK] Seq=809 Ack=809 Win=8185 Len=0 TSval=471154222 TSecr=1889744321"
"246","2014-08-08 13:20:52,040383","107.20.214.173","10.5.1.107","TCP","66","443  >  40889 [ACK] Seq=1 Ack=216 Win=15616 Len=0 TSval=912761808 TSecr=772369"
"247","2014-08-08 13:20:52,047946","107.20.214.173","10.5.1.107","TLSv1.2","1514","Server Hello"
"248","2014-08-08 13:20:52,047997","107.20.214.173","10.5.1.107","TLSv1.2","2275","Certificate, Server Key Exchange, Server Hello Done"
"249","2014-08-08 13:20:52,048395","10.5.1.107","107.20.214.173","TCP","66","40889  >  443 [ACK] Seq=216 Ack=1449 Win=17536 Len=0 TSval=772394 TSecr=912761810"
"250","2014-08-08 13:20:52,048403","10.5.1.107","107.20.214.173","TCP","66","40889  >  443 [ACK] Seq=216 Ack=2897 Win=20480 Len=0 TSval=772394 TSecr=912761810"
"251","2014-08-08 13:20:52,048406","10.5.1.107","107.20.214.173","TCP","66","40889  >  443 [ACK] Seq=216 Ack=3658 Win=23296 Len=0 TSval=772394 TSecr=912761810"
"252","2014-08-08 13:20:52,053654","10.5.1.107","107.20.214.173","TLSv1.2","192","Client Key Exchange, Change Cipher Spec, Encrypted Handshake Message"
"253","2014-08-08 13:20:52,152675","107.20.214.173","10.5.1.107","TLSv1.2","308","New Session Ticket, Change Cipher Spec, Encrypted Handshake Message"
"254","2014-08-08 13:20:52,153620","10.5.1.107","107.20.214.173","TLSv1.2","885","Application Data"
"255","2014-08-08 13:20:52,286059","107.20.214.173","10.5.1.107","TCP","66","443  >  40889 [ACK] Seq=3900 Ack=1161 Win=17408 Len=0 TSval=912761870 TSecr=772420"
"256","2014-08-08 13:20:52,288006","50.19.128.88","10.5.1.107","TLSv1.2","183","Application Data"
"257","2014-08-08 13:20:52,288265","10.5.1.107","50.19.128.88","TCP","66","33110  >  443 [ACK] Seq=809 Ack=926 Win=331 Len=0 TSval=772454 TSecr=1889744397"
"258","2014-08-08 13:20:52,294070","107.20.214.173","10.5.1.107","TLSv1.2","588","Application Data"
"259","2014-08-08 13:20:52,330687","10.5.1.107","107.20.214.173","TCP","66","40889  >  443 [ACK] Seq=1161 Ack=4422 Win=29184 Len=0 TSval=772465 TSecr=912761871"
"260","2014-08-08 13:20:52,566758","Cisco_45:7e:30","PVST+","STP","64","RST. Root = 32768/501/70:ca:9b:45:7e:00  Cost = 0  Port = 0x8030"
"261","2014-08-08 13:20:52,913844","10.5.1.107","10.5.1.1","DNS","76","Standard query 0x2f65 A pwning.slack.com"
"262","2014-08-08 13:20:52,927420","10.5.1.1","10.5.1.107","DNS","293","Standard query response 0x2f65 A pwning.slack.com A 107.20.214.173 NS ns-606.awsdns-11.net NS ns-166.awsdns-20.com NS ns-1901.awsdns-45.co.uk NS ns-1493.awsdns-58.org A 205.251.192.166 A 205.251.194.94 A 205.251.197.213 A 205.251.199.109"
"263","2014-08-08 13:20:52,927921","10.5.1.107","10.5.1.1","DNS","76","Standard query 0x3d57 A pwning.slack.com"
"264","2014-08-08 13:20:52,928268","10.5.1.1","10.5.1.107","DNS","293","Standard query response 0x3d57 A pwning.slack.com A 107.20.214.173 NS ns-166.awsdns-20.com NS ns-1901.awsdns-45.co.uk NS ns-606.awsdns-11.net NS ns-1493.awsdns-58.org A 205.251.192.166 A 205.251.194.94 A 205.251.197.213 A 205.251.199.109"
"265","2014-08-08 13:20:53,052224","10.5.1.2","50.19.128.88","TLSv1.2","199","Application Data"
"266","2014-08-08 13:20:53,081470","10.5.1.110","50.19.128.88","TLSv1.2","167","Application Data"
"267","2014-08-08 13:20:53,144717","50.19.128.88","10.5.1.2","TLSv1.2","199","Application Data"
"268","2014-08-08 13:20:53,145175","10.5.1.2","50.19.128.88","TCP","66","59338  >  443 [ACK] Seq=1065 Ack=1065 Win=331 Len=0 TSval=1619910 TSecr=1889744611"
"269","2014-08-08 13:20:53,175619","50.19.128.88","10.5.1.110","TLSv1.2","167","Application Data"
"270","2014-08-08 13:20:53,175867","10.5.1.110","50.19.128.88","TCP","66","42228  >  443 [ACK] Seq=809 Ack=809 Win=228 Len=0 TSval=1000288 TSecr=1889744619"
"271","2014-08-08 13:20:53,662394","10.5.1.2","23.203.220.244","TLSv1.2","1175","Application Data"
"272","2014-08-08 13:20:53,685590","23.203.220.244","10.5.1.2","TCP","66","443  >  47195 [ACK] Seq=2926 Ack=11059 Win=43654 Len=0 TSval=3038540008 TSecr=1620014"
"273","2014-08-08 13:20:53,685842","23.203.220.244","10.5.1.2","TLSv1.2","391","Application Data"
"274","2014-08-08 13:20:53,686313","10.5.1.2","23.203.220.244","TCP","66","47195  >  443 [ACK] Seq=11059 Ack=3251 Win=331 Len=0 TSval=1620018 TSecr=3038540009"
"275","2014-08-08 13:20:53,989399","108.160.167.157","10.5.1.108","HTTP","245","HTTP/1.1 200 OK  (text/plain)"
"276","2014-08-08 13:20:53,989847","10.5.1.108","108.160.167.157","TCP","66","49162  >  80 [ACK] Seq=1 Ack=180 Win=8180 Len=0 TSval=471156222 TSecr=2260964986"
"277","2014-08-08 13:20:53,992894","10.5.1.108","108.160.167.157","HTTP","618","GET /subscribe?host_int=478314626&ns_map=23728482_7619295711586%2C353900579_322476447779%2C89242026_326506756522%2C184844043_25954647819%2C183594511_20916674326031%2C187888985_8777823577%2C267867802_1104074462874%2C314512655_2641719399695%2C207177148_1198503052732%2C250091562_4260857649194%2C216883358_-1&user_id=15197322&nid=1381653161632283905&ts=1407518453 HTTP/1.1 "
"278","2014-08-08 13:20:54,014517","108.160.167.157","10.5.1.108","TCP","66","80  >  49162 [ACK] Seq=180 Ack=553 Win=83 Len=0 TSval=2260964992 TSecr=471156224"
"279","2014-08-08 13:20:54,052002","10.5.1.106","239.255.255.250","SSDP","212","M-SEARCH * HTTP/1.1 "
"280","2014-08-08 13:20:54,171702","10.5.1.107","50.19.128.88","TLSv1.2","167","Application Data"
"281","2014-08-08 13:20:54,266271","50.19.128.88","10.5.1.107","TLSv1.2","167","Application Data"
"282","2014-08-08 13:20:54,266597","10.5.1.107","50.19.128.88","TCP","66","33110  >  443 [ACK] Seq=910 Ack=1027 Win=331 Len=0 TSval=772948 TSecr=1889744891"
"283","2014-08-08 13:20:54,306283","10.5.16.2","10.5.1.2","TCP","74","52609  >  4444 [SYN] Seq=0 Win=29200 Len=0 MSS=1460 SACK_PERM TSval=2377826 TSecr=0 WS=128"
"284","2014-08-08 13:20:54,306684","10.5.1.2","10.5.16.2","TCP","74","4444  >  52609 [SYN, ACK] Seq=0 Ack=1 Win=14480 Len=0 MSS=1460 SACK_PERM TSval=1620143 TSecr=2377826 WS=128"
"285","2014-08-08 13:20:54,306932","10.5.16.2","10.5.1.2","TCP","66","52609  >  4444 [ACK] Seq=1 Ack=1 Win=29312 Len=0 TSval=2377826 TSecr=1620143"
"286","2014-08-08 13:20:54,307481","10.5.16.2","10.5.1.2","HTTP","310","TRACE /415.html HTTP/1.1  (*)"
"287","2014-08-08 13:20:54,307935","10.5.1.2","10.5.16.2","TCP","66","4444  >  52609 [ACK] Seq=1 Ack=245 Win=15616 Len=0 TSval=1620143 TSecr=2377826"
"288","2014-08-08 13:20:54,309478","10.5.1.2","10.5.16.2","HTTP","578","TRACE /415.html HTTP/1.1  (*)Continuation"
"289","2014-08-08 13:20:54,309728","10.5.16.2","10.5.1.2","TCP","66","52609  >  4444 [ACK] Seq=245 Ack=513 Win=30336 Len=0 TSval=2377827 TSecr=1620143"
"290","2014-08-08 13:20:54,311499","10.5.16.2","10.5.1.2","TCP","66","52609  >  4444 [FIN, ACK] Seq=245 Ack=513 Win=30336 Len=0 TSval=2377827 TSecr=1620143"
"291","2014-08-08 13:20:54,351228","10.5.1.2","10.5.16.2","TCP","66","4444  >  52609 [ACK] Seq=513 Ack=246 Win=15616 Len=0 TSval=1620152 TSecr=2377827"
"292","2014-08-08 13:20:54,577096","Cisco_45:7e:30","PVST+","STP","64","RST. Root = 32768/501/70:ca:9b:45:7e:00  Cost = 0  Port = 0x8030"
"293","2014-08-08 13:20:54,606115","10.5.1.103","50.19.128.88","TLSv1.2","167","Application Data"
"294","2014-08-08 13:20:54,698249","50.19.128.88","10.5.1.103","TLSv1.2","167","Application Data"
"295","2014-08-08 13:20:54,698762","10.5.1.103","50.19.128.88","TCP","66","55792  >  443 [ACK] Seq=910 Ack=910 Win=8185 Len=0 TSval=1003774341 TSecr=1889744999"
"296","2014-08-08 13:20:54,892583","10.5.1.108","50.19.128.88","TLSv1.2","167","Application Data"
"297","2014-08-08 13:20:54,986787","50.19.128.88","10.5.1.108","TLSv1.2","167","Application Data"
"298","2014-08-08 13:20:54,987230","10.5.1.108","50.19.128.88","TCP","66","49312  >  443 [ACK] Seq=910 Ack=910 Win=8185 Len=0 TSval=471157216 TSecr=1889745072"
"299","2014-08-08 13:20:55,053073","10.5.1.106","239.255.255.250","SSDP","212","M-SEARCH * HTTP/1.1 "
"300","2014-08-08 13:20:55,546274","fe80::f2de:f1ff:fe6c:7c3e","ff02::2","ICMPv6","62","Router Solicitation"
"301","2014-08-08 13:20:55,746948","10.5.1.2","23.203.220.244","TLSv1.2","1159","Application Data"
"302","2014-08-08 13:20:55,809101","23.203.220.244","10.5.1.2","TCP","66","443  >  47195 [ACK] Seq=3251 Ack=12152 Win=43654 Len=0 TSval=3038542133 TSecr=1620431"
"303","2014-08-08 13:20:55,817432","23.203.220.244","10.5.1.2","TLSv1.2","391","Application Data"
"304","2014-08-08 13:20:55,817883","10.5.1.2","23.203.220.244","TCP","66","47195  >  443 [ACK] Seq=12152 Ack=3576 Win=331 Len=0 TSval=1620445 TSecr=3038542141"
"305","2014-08-08 13:20:55,837850","10.5.1.110","69.16.175.10","TCP","74","41329  >  80 [SYN] Seq=0 Win=14600 Len=0 MSS=1460 SACK_PERM TSval=1000953 TSecr=0 WS=128"
"306","2014-08-08 13:20:55,849680","69.16.175.10","10.5.1.110","TCP","74","80  >  41329 [SYN, ACK] Seq=0 Ack=1 Win=14480 Len=0 MSS=1460 SACK_PERM TSval=1640926691 TSecr=1000953 WS=256"
